image_id,X,Y,Width,Height,English_text,French_text
2372041,86,20,46,275,Fork standing in the water,
2372053,7,7,491,365,white cabinets are in the kitchen,
2372055,102,188,126,205,a grey dog,
2372062,115,15,115,212,Man skiing down the mountainside,
2372063,94,170,181,75,a red truck.,
2372064,53,0,260,180,A large steel oven vent hood,
2372066,68,30,308,270,a red double decker bus,
2372067,243,443,210,37,shadow is on the ground,
2372079,217,206,67,67,white official sized soccer ball,
2372084,1,0,497,59,The sky is blue.,
2372091,84,17,212,464,a large black and brown dog,
2372096,188,349,21,13,Green leaf on vine.,
2372098,216,110,12,64,window on side of the train,
2372099,112,74,277,72,black and white so excited sign,
2372102,94,14,254,316,woman with brown curly hair,
2372103,101,151,106,104,The clock face is white.,
2372104,30,87,435,224,black and red hot dog truck,
2372106,6,146,350,146,people riding a boat,
2372111,19,18,439,301,photograph of a train station,
2372117,106,30,296,239,a pile of fruits,
2372124,52,66,288,379,orange cat on desk,
2372134,21,249,66,48,Monkey on ground,
2372137,0,5,486,337,a tray of food,
2372138,254,206,63,167,a bird standing on a post,
2372143,327,23,109,108,kite flying low to the ground,
2372150,66,189,6,7,A red colored button,
2372154,241,82,107,140,The white shirt the child is wearing.,
2372168,0,5,492,360,This is a child,
2372171,160,27,217,95,The sign says Apliu,
2372172,31,7,98,54,man has black cap,
2372175,300,20,199,275,The red tarp on the elephant's back,
2372177,1,0,304,76,The sky is white.,
2372180,269,145,40,75,red fire hydrant,
2372181,16,88,131,81,black and white zebra,
2372193,110,166,22,40,Person walking on icy sidewalk,
2372196,5,1,490,93,blue sky and clouds over tops of buildings,
2372197,96,110,99,73,baby has thin hair,
2372198,152,22,279,257,man is playing baseball,
2372199,151,125,324,122,Elephants in the field.,
2372202,120,205,14,25,A gray bag in the photo.,
2372204,326,180,55,57,this is a person,
2372210,77,3,332,229,A red motorcycle.,
2372211,116,44,159,203,this guy is standing on a skateboard,
2372217,382,25,95,222,this is a post,
2372218,215,156,252,215,this this is an apple,
2372224,16,157,372,312,left wing of an airplane,
2372225,204,368,15,20,a bottle is sitting on the floor,
2372251,134,98,67,38,white cloud in sky,
2372253,2,15,430,261,man riding a horse,
2372258,198,109,107,99,yellow liquid egg yolk,
2372261,3,100,491,130,this is a train,
2372264,26,69,447,158,yellow bananas laying on a table,
2372269,0,377,163,120,this is a railway line,
2372271,214,115,8,16,a roman numeral one,
2372272,222,172,159,125,a wood coffee table,
2372273,41,6,440,225,a yellow school bus,
2372284,324,16,173,100,a black and white umbrella,
2372285,150,450,44,23,a slice of tomatoe,
2372297,29,43,314,221,black and white zebra,
2372299,137,51,332,322,guys standing and playing video games,
2372301,86,130,320,242,a laptop computer,
2372306,201,137,203,191,Black and white cow,
2372311,2,112,347,380,this is a teddy bear,
2372314,37,113,90,224,lit up clock on building,
2372323,59,128,260,294,sandwich is in bag,
2372324,206,2,19,241,This is a tree,
2372330,253,34,195,92,A clear blue sky,
2372332,203,93,130,247,a woman kneeling on grass,
2372333,262,319,106,54,the pillow on the bench,
2372334,2,0,239,389,this is a picture,
2372339,135,234,57,28,black adult cat,
2372344,17,27,321,468,Picture taken outside.,
2372345,0,1,195,203,two gray stones on ground,
2372347,262,347,70,130,a white porcelain toilet bowl,
2372350,8,1,349,356,The liquid is purple,
2372360,156,85,80,168,the man is sitting on the back of the truck,
2372371,0,1,497,380,a bunch of candy apples,
2372375,9,46,359,444,postcard featuring a clock,
2372376,79,25,357,270,bench on the concrete,
2372377,192,108,293,144,The train car is silver,
2372382,135,178,53,63,The man is on a motorcycle,
2372385,386,239,37,61,Wheel of a truck,
2372387,52,47,308,434,refrigerator and freezer,
2372391,9,15,479,305,the picture is black and white,
2372393,34,198,347,93,three boats near the river shore,
2372399,5,446,91,49,upc symbol at the bottom left,
2372400,239,78,32,27,this is a sack,
2372401,143,45,55,91,This is a lamp,
2372403,212,105,93,111,person on water ski,
2372405,262,118,43,80,traffic light attached to pole,
2372412,208,53,65,80,framed photograph on wall,
2372414,1,144,497,229,A non-professional baseball game,
2372417,38,184,290,276,A delicious prepared burger,
2372419,146,51,210,248,man playing tennis,
2372420,80,144,260,172,a yellow bat,
2372424,83,25,314,468,the man is skiing,
2372432,26,257,21,136,blue metal fence panel,
2372433,15,67,235,72,group of wicker baskets,
2372436,77,36,105,275,Door in the bathroom,
2372438,67,143,17,32,the towle is lime green,
2372441,57,55,180,399,the giraffe standing on the dirt in a field,
2372442,58,47,341,362,three zebras in front of a giraffe,
2372444,56,2,159,66,an umbrella over their heads,
2372445,97,178,58,103,A white toilet.,
2372459,78,112,380,307,cat laying on a desk,
2372462,374,179,106,121,A zebra eating grass,
2372463,134,178,213,145,Woman with a surfboard standing in the sand,
2372464,52,30,347,293,A ship is docked at a marina,
2372465,91,265,331,122,Reflection of red bus,
2372466,238,193,27,16,meat topping on a pizza,
2372467,2,1,485,251,The train is white and black,
2372472,65,107,225,203,stuffed animal sitting on a laptop,
2372484,158,10,134,486,the clear bottle on the table,
2372487,35,36,397,252,a truck on a rack,
2372491,250,188,23,20,picture on wall,
2372497,334,97,78,22,An elephant tail in the photo.,
2372502,71,130,155,282,Man tennis player preparing to serve,
2372503,256,128,149,182,macaroni and cheese,
2372505,178,128,130,103,lone black faced sheep,
2372511,310,134,85,222,A white dress in the photo.,
2372514,3,184,239,259,the truck is black,
2372517,42,301,152,70,Pile of sauteed onions in pan,
2372523,272,123,119,96,this is an egg,
2372529,2,155,366,339,plate with food on it,
2372531,22,299,56,74,A baby duckling,
2372535,222,127,87,57,freshly home made bread,
2372538,230,307,159,32,edge of silver fence,
2372539,105,86,76,30,woman is wearing sun glasses,
2372548,76,182,100,85,A woman's bicycle parked against the wall,
2372553,35,45,447,326,This is a zebra,
2372554,56,82,256,220,the man is surfing,
2372555,4,45,118,207,poste with red background hanging on wall,
2372557,134,47,164,172,boy is playing tennis,
2372558,349,150,20,54,man wearing gray sweatshirt,
2372569,225,152,84,140,man playing tennis,
2372572,106,84,7,7,window on side of building,
2372573,1,1,218,177,stuffed panda to the left of stuffed panda,
2372574,23,366,251,115,The ground is made of asphalt,
2372577,4,7,492,365,A street intersection scene,
2372579,120,74,138,302,rusty old fire hydrant,
2372580,164,95,100,120,A kite with a flying pig design.,
2372581,33,15,466,188,group of four dogs,
2372587,14,88,477,246,a classic antique car,
2372588,116,55,110,201,A red white and blue fire hydrant,
2372591,297,203,70,58,watermelon with end cut off,
2372597,132,116,199,379,A man dragging a suitcase,
2372606,255,227,135,85,shadow of a skier,
2372607,155,316,58,126,a white flower painted vase.,
2372613,127,43,39,32,the carrots are long,
2372614,161,167,69,55,frisbee in the air,
2372615,256,180,19,29,Bell hanging under the neck of the cow,
2372616,420,75,79,140,cow in a field,
2372617,15,66,470,251,a bench by the water,
2372620,63,234,69,59,kite above the ocean,
2372625,221,113,234,252,tennis player standing at baseline,
2372627,353,176,29,30,speck of snow in air,
2372629,340,161,40,49,white letter painted on building,
2372632,99,75,145,257,the man walking on the street,
2372636,157,252,36,39,clock on the side of the building,
2372638,285,216,97,127,man on skis at top of hill,
2372639,229,204,70,100,skier going down mountain,
2372642,2,122,496,360,two halves of a sandwich,
2372648,103,385,86,68,the shoe is gray,
2372651,19,23,455,280,the pattern appears to be the American Flag,
2372653,367,3,17,25,the windows of a building,
2372655,126,190,57,23,number 143 on the bus,
2372660,162,24,190,77,Blonde hair in the picture.,
2372673,47,0,366,332,two horses pulling a cart,
2372676,45,260,215,207,red double decker bus,
2372678,82,47,147,230,A boat sailing in the water.,
2372679,101,29,188,204,the train is green and yellow,
2372686,416,108,76,197,two kids standing by the elephants,
2372690,313,67,18,17,Round green light on traffic pole,
2372696,90,43,363,308,Bus parked on the road,
2372703,9,20,490,350,a food mart with packaged meat,
2372711,90,2,257,43,light coming in the windshield,
2372717,92,70,250,166,The zebroid is striped,
2372719,181,68,157,285,A giraffe in the trees,
2372743,100,66,22,22,goatee around the mouth,
2372744,170,282,52,57,left foot of skiier,
2372745,410,230,15,64,A red post in the ground.,
2372748,225,45,12,12,tennis ball in the air,
2372753,209,167,17,27,airplane in the sky,
2372763,428,43,64,142,man wear an apron,
2372766,193,55,285,198,one half panini sandwhich,
2372769,62,74,72,128,man riding a bicycle,
2372770,76,293,40,46,White poodle.,
2372771,99,64,272,232,The sheep is eating the grass,
2372775,133,137,109,223,A black refrigerator.,
2372779,209,149,102,36,a lip balm with pink lid,
2372780,175,118,182,107,A black and white goat,
2372786,214,60,153,300,a woman wearing a checkered white and red shirt,
2372792,375,157,85,111,player watching game from dugout,
2372794,17,9,471,320,Two rear ends of elephants,
2372795,123,267,41,79,the water dripping from the man's glove,
2372797,105,349,63,58,clock on side of building,
2372799,67,84,186,288,while clock tower on top of building,
2372802,29,22,291,157,the plane is flying,
2372807,210,241,17,17,neon yellow tennis ball,
2372811,107,269,62,57,the grass is dead,
2372819,130,298,56,23,a white base,
2372824,157,13,255,190,motorbike rider performing a flip,
2372826,156,11,173,156,A large kite being flown,
2372829,47,82,362,226,kites flying over beach,
2372830,195,215,52,48,left shoe of woman,
2372831,153,116,107,283,Man flying a kite in a park,
2372838,11,66,141,237,Boy running on the grass,
2372844,231,16,68,96,Light on hotel room wall,
2372847,1,14,318,325,woman eating a muffin,
2372856,247,238,45,57,right knee of guy,
2372860,150,68,176,74,the name of the place on the clock,
2372868,83,43,397,330,laptop on the desk,
2372875,15,117,225,72,A silver trian.,
2372880,100,0,126,327,skateboarder in motion,
2372884,17,9,453,308,a baseball scene at a park,
2372887,68,265,109,178,glass with a spoon in it,
2372894,111,13,112,80,man is wearing glasses,
2372896,199,57,152,142,elephant standing in green grass,
2372901,263,11,150,315,baseball player swinging,
2372903,397,111,96,117,Blue print on white tray,
2372913,42,21,447,423,woman leaning on something,
2372916,100,218,265,85,red and white bed cover,
2372917,129,110,332,106,wide white surfboard,
2372920,157,70,162,240,a bear standing up against the glass,
2372927,2,0,490,430,Young boy holding two saucers,
2372930,80,96,352,238,Several people flying kites,
2372942,49,93,41,77,Man in a green t shirt and baseball cap,
2372945,140,145,74,156,a woman serving a tennis ball,
2372946,112,128,255,150,Two yellow and green trains side by side,
2372951,207,162,50,38,white parasail,
2372953,130,39,101,85,fuchsia cap on a little girl,
2372959,52,173,157,198,A black framed bicycle.,
2372961,39,87,180,60,Circular red plastic frisbee,
2372966,15,13,271,173,fall leaves on tree,
2372968,2,212,75,117,blue trash can filled with paper,
2372969,291,167,98,125,Crane bird showing it's shadow.,
2372971,100,105,300,85,Yellow airplane in the air,
2372974,132,153,41,41,A white ball in the air,
2372980,100,26,172,116,a large red and yellow umbrella,
2372987,179,182,98,53,black kite,
2372991,88,79,55,146,Man carries skateboard,
2373000,131,121,255,145,Three giraffes standing outside,
2373001,41,55,191,261,a white porcelain toilet bowl,
2373003,11,0,251,466,a vehicle is going through slush,
2373007,192,175,178,68,designer's signature reads 'Karin',
2373008,351,125,97,198,a man sitting and playing the guitar,
2373009,192,158,69,51,large red kite flying through the air,
2373014,117,284,42,22,a man's tennis shoe,
2373016,132,186,58,59,falling snowboarder wearing a black beanie,
2373018,128,75,67,63,round top of a black trash bin,
2373023,3,178,494,150,net in middle of tennis court,
2373026,106,20,117,155,a small toy car,
2373027,146,127,112,167,Woman skiing down hill,
2373039,33,112,296,173,the train on the track,
2373043,4,86,491,102,Cargo airplane in the sky,
2373045,0,93,484,134,group of animals at the zoo,
2373047,195,98,60,17,a silver drawer handle,
2373050,14,34,445,134,white blue and gold plane in flight,
2373052,76,171,207,78,black and white street sign,
2373054,20,18,457,297,vegetables and butter in pot,
2373060,56,42,433,310,a hot dog on a white dish,
2373061,62,106,298,182,Brown cow,
2373063,316,161,12,62,Orange number on back of shirt,
2373065,88,138,235,211,black and red train,
2373067,75,125,138,67,arabic writing on traffic sign,
2373075,147,161,52,38,cow drinking from pond,
2373078,195,123,117,153,blue and gold clock,
2373079,266,139,67,94,young man riding red colored motorcycle,
