image_id,X,Y,Width,Height,English_text,French_text
2354233,74,131,251,56,BLACK STREET SIGN ON POLE,
2354234,47,404,251,94,a white star on ground,
2354239,3,142,388,121,White boat in the water,
2354242,38,60,281,388,Animals in a pen.,
2354245,44,0,31,20,the light on the ceiling,
2354246,60,214,13,145,a parking meter,
2354251,179,89,20,39,the outlet on the wall,
2354255,58,200,192,298,Small child holding frisbee,
2354259,10,2,478,365,Photo takes place in a kitchen,
2354261,77,57,114,87,the people are on the elephant,
2354263,0,116,499,215,a large grassy hill,
2354268,192,133,61,65,the man is wearing a helmet,
2354269,65,67,246,366,man wearing tie,
2354273,0,62,499,217,a snowy hilly landscape,
2354277,246,252,105,33,blue top of fence,
2354281,198,29,92,103,a pitcher glove for baseball,
2354282,163,13,181,107,a blue awning,
2354284,72,65,28,38,There is a very large headlight visible,
2354285,1,1,442,277,Woman and dog sitting on blanket by the water,
2354287,234,107,21,15,silver logo on back of car,
2354288,118,20,150,195,a man holding a baseball bat,
2354290,149,121,116,73,capital letters on the sign,
2354291,84,73,392,297,a beautiful view of food,
2354292,150,28,338,230,a group of people,
2354294,139,49,96,53,a man wearing glasses,
2354297,203,280,143,47,Grass growing from the cracks.,
2354308,256,157,170,70,Three animals on the beach,
2354311,18,362,33,64,Tooth brush in a holder,
2354315,3,281,25,37,shadow on the sidewalk.,
2354316,0,3,371,235,deep blue sky with a white cloud,
2354318,356,90,100,95,Large gray elephant looking to the right,
2354319,3,294,361,153,A white bus.,
2354322,3,2,493,217,light of daytime sky,
2354323,437,280,6,11,part of a sweater,
2354324,172,23,32,34,vinyl LP hanging in window,
2354325,201,218,192,112,people walking down the street,
2354329,271,104,171,148,person skiing down a slope,
2354341,135,109,135,119,Small bird in the water,
2354343,83,48,202,167,person above the water,
2354349,307,180,135,127,yellow and black bird on right,
2354352,213,216,122,41,Yellow tent on the beach,
2354360,334,129,78,136,blue and red fire hydrant,
2354361,206,169,53,40,the glove on the catcher's hand,
2354374,121,301,134,154,Girl holding white Wii remote,
2354376,0,172,97,80,Large pile of rock on the floor of the enclosure,
2354377,197,275,63,30,person has green shoes,
2354378,60,19,245,466,toddler brushing teeth with green brush,
2354379,243,150,23,45,A traffic light lit up green,
2354381,113,6,307,286,This is a train,
2354386,315,170,129,54,A bench facing the camera.,
2354387,58,37,436,457,one elephant in front of another elephant,
2354391,69,253,237,234,a man playing tennis,
2354395,353,133,56,54,the hammer on the toilet,
2354398,1,0,235,212,television sitting on entertainment center,
2354399,0,116,362,267,donuts are in the box,
2354401,67,30,367,342,and astronomical clock on wall,
2354408,95,68,189,236,man doing a jump on a snowboard,
2354409,241,123,122,116,this is a card,
2354411,2,2,310,209,blue of daytime sky,
2354415,77,56,277,192,Dark brown horse in samd,
2354416,89,3,342,315,two people are skiing,
2354418,29,166,411,329,skier lifting leg showing underside of ski,
2354422,246,14,45,88,White clouds in the sky,
2354426,373,297,60,10,dirt on the ground.,
2354432,119,105,305,191,Cows in a field,
2354441,255,208,152,48,grey stone bench on ground,
2354444,19,48,386,148,the plane is white,
2354445,385,12,100,22,this is the sky,
2354467,254,139,54,74,this is a glass,
2354476,70,129,380,107,A train is on a track,
2354477,136,19,124,75,sky above the land,
2354479,106,60,195,189,a man is surfing,
2354480,309,220,49,86,brown and red bird,
2354487,99,90,47,44,Black spots on animal,
2354488,126,212,203,141,White and red tennis racket,
2354489,355,18,75,45,blue and pink color on wall,
2354491,153,40,87,32,small blue tiles on the wall,
2354492,49,27,76,35,A bird is flying,
2354497,180,193,150,137,Yellow toy in dogs mouth,
2354510,172,154,122,167,a clear vase with flowers,
2354511,154,41,8,11,The N on the compass direction pole.,
2354516,299,26,173,284,brown and white cow,
2354524,288,107,31,30,part of a cloud,
2354527,326,147,71,172,Traffic control signal light,
2354529,59,7,30,17,this is the sky,
2354531,367,20,105,215,this is the sky,
2354536,95,6,72,162,the door is open,
2354544,7,18,473,466,a cat looking at the camera,
2354550,26,270,174,91,a floral pattern is on the rug,
2354554,90,179,6,6,The handle to flush the toilet.,
2354555,260,114,68,100,girl is in bed,
2354558,140,54,160,277,long silver Cox remote with many buttons,
2354560,160,139,205,69,red stripe on an airplane,
2354562,184,69,297,261,Three giraffe in the zoo,
2354563,0,2,497,368,a pickup in gas station,
2354570,94,73,215,242,this is a cow,
2354571,255,143,183,167,front tire of bike,
2354573,318,176,38,75,Black and white strips,
2354575,181,303,28,37,part of a plate,
2354586,164,30,115,85,this is the sky,
2354589,78,113,87,114,this is a man,
2354591,207,22,19,42,part of a letter,
2354592,57,122,100,154,Brown bear in water,
2354599,305,2,190,90,two windows on building,
2354605,82,66,81,35,Nashville is in the great state of TN.,
2354606,73,84,274,289,bear washing up in water,
2354610,31,86,385,217,small sheep sitting on grass,
2354614,142,190,160,54,The bench facing the water.,
2354617,0,235,213,242,fruit is large round orange orange,
2354619,307,0,192,343,A small wooded area of dead trees,
2354621,174,141,305,132,This is a train,
2354623,1,2,497,152,gray clouds in sky,
2354625,77,347,66,84,white pitchers on the counter,
2354628,62,75,300,199,a motorcycle on the street,
2354629,264,140,185,233,A woman sitting at a table.,
2354634,162,131,286,165,two men at a table,
2354639,132,53,85,176,a dark pink dress on a girl,
2354646,378,19,58,57,Small golden brown pastry in a fryer,
2354657,12,47,334,276,two men are seated,
2354671,196,366,33,35,the ball in mid air,
2354672,1,13,496,361,two giraffes standing outside,
2354681,83,173,211,161,a dog on a man's back,
2354684,1,0,368,450,Man in a dress shirt.,
2354685,275,154,220,151,the light colored curved sofa,
2354688,169,234,155,16,the words,
2354689,219,3,277,251,Person bent over a computer.,
2354703,329,52,72,110,a skier turned away,
2354705,211,118,102,172,White fire hydrant on the ground,
2354709,107,56,100,76,green leaves on a tree,
2354715,63,25,243,261,a boy on a skateboard,
2354717,217,148,75,41,brown sheep standing on top of snow,
2354721,19,31,473,300,a room is in a mess,
2354725,145,96,81,81,the beak of a bird,
2354728,411,160,12,5,The foot of the surfer.,
2354731,163,28,232,246,this is an elephant,
2354737,120,457,29,26,part of a ground,
2354738,224,298,73,30,this is the ground,
2354743,194,216,77,33,floral pattern on wall,
2354745,226,130,219,98,White boats on a wooden truck bed.,
2354746,91,290,78,35,this is the road,
2354750,175,214,150,117,this is the sink,
2354758,232,73,48,86,White steeple on building.,
2354760,215,15,33,51,part of a window,
2354764,178,193,198,131,this is a cow,
2354768,331,285,32,32,part of a shirt,
2354770,58,131,62,57,print on the wall,
2354771,337,174,46,41,part of a train,
2354774,386,208,37,64,a woman is sitting in the chair,
2354779,85,184,229,305,dog wearing white cowboy hat,
2354784,232,134,31,30,part of a food,
2354797,115,0,341,385,A cat leaning into a toilet bowl.,
2354803,113,151,209,242,pink box of pastries,
2354814,152,97,53,57,the eye of a elephant,
2354816,235,51,84,95,this is a bench,
2354817,155,189,44,120,this is a bottle,
2354822,17,145,324,70,a toy train on a track,
2354829,5,46,342,453,children in ball attire,
2354833,36,167,50,50,this is a toilet sink,
2354834,208,147,75,76,a boy wearing a helmet,
2354845,221,68,82,80,Big red number 42 on back of jersey.,
2354849,0,0,75,101,a colorful cup on a counter,
2354858,13,358,136,126,Grass in a field.,
2354860,130,110,48,21,The shorts the surfer is wearing.,
2354867,66,131,75,141,woman is holding a knife,
2354868,124,35,88,59,the head of a man,
2354878,334,28,42,25,a plane in the sky,
2354882,120,87,72,159,This is a flower vase,
2354884,143,199,227,107,this is a cake,
2354885,9,25,471,346,This is a motorcycle,
2354888,1,227,53,50,plastic alien toy on the desk,
2354889,147,73,331,258,woman playing tennis match,
2354894,223,443,27,52,part of a sheet,
2354896,343,29,117,122,man under a tent,
2354898,326,15,110,105,the sky is blue in colour,
2354899,213,243,15,22,part of a paper,
2354901,264,115,105,122,Man with red suit on red and white motorcycle.,
2354905,3,148,72,72,This is a cow,
2354910,59,222,200,62,headlights on a bus,
2354911,163,270,27,36,edge of a log,
2354914,8,10,490,363,white snowflakes is falling,
2354918,75,113,310,130,this is a bus,
2354929,186,82,96,110,White t-shirt with screenprinted image,
2354930,154,3,219,164,person wearing green shirt eating cake,
2354933,131,53,165,287,the pole is white in colour,
2354935,43,16,278,435,this is taken outside,
2354949,32,88,288,355,man in red shirt playing wii,
2354953,91,269,86,156,this is a phone,
2354956,336,122,101,83,This is a seat,
2354959,134,202,97,40,Black number 7258 on the side of boat.,
2354960,387,127,65,203,this is a giraffe,
2354974,206,1,292,46,celing panels in room,
2354981,153,58,110,147,a teddy bear sitting in a bike helmet,
2354987,302,132,51,164,boy playing frisbee in a park,
2354993,12,15,439,287,this is a woman,
2354994,236,121,36,34,black shoe with white laces,
2354995,326,281,27,48,part of a board,
2354996,278,80,35,23,sheep eating green grass,
2355000,117,40,185,196,man wearing yellow shirt,
2355003,8,326,48,35,Man with dark glasses on his face.,
2355007,83,96,113,158,the man is looking down,
2355011,213,132,61,84,the wall is white in colour,
2355022,272,303,10,15,part of a plain,
2355026,28,234,147,97,man wearing khaki pants,
2355028,17,68,348,175,A large white puppy.,
2355029,83,284,125,69,dog sitting on sidewalk,
2355036,2,134,186,242,man wearing plaid shirt,
2355037,7,7,491,361,picture taken outside,
2355041,257,155,65,30,The surfboard the man is on.,
2355047,103,164,61,34,Microwave on a countertop,
2355052,288,62,34,42,Small black apple symbol on screen.,
2355055,232,81,162,270,Woman skiing in the snow.,
2355074,182,153,158,312,Smiling man behind the counter,
2355083,50,92,204,376,this is a girl,
2355085,165,59,151,123,the head of a bird,
2355092,187,116,130,329,Man getting something out of oven.,
2355099,20,51,318,387,baby head with toothbrush,
2355101,84,237,39,30,Books on top of the toilet,
2355102,62,100,57,102,Illustration of a windmill,
2355103,245,126,16,13,A plastic red fruit,
2355105,211,134,205,239,white laptop on table,
2355106,181,168,10,15,[part of a post,
2355107,39,37,457,200,red truck in front of luggage,
2355113,41,43,377,382,soccer in the rain,
2355114,237,213,191,81,Green and white street sign swinging.,
2355119,260,167,128,125,person wearing brown jacket,
2355123,90,0,27,449,Long thin metal pole,
