image_id,X,Y,Width,Height,English_text,French_text
2345743,61,17,246,214,girl is holding a bat,
2345744,84,87,330,140,group of cows crossing road,
2345747,70,248,38,17,THAT IS A BRICK,
2345753,0,127,92,145,The bowl is white.,
2345758,258,200,95,103,this is an apple,
2345760,260,221,47,33,horse grazing in the field,
2345765,125,3,275,281,Waves from water,
2345766,371,115,92,207,a person holding a umbrella,
2345772,19,180,89,91,yellow flowers in field,
2345788,128,0,130,210,Man wearing a baseball cap,
2345789,282,200,176,174,A blue metal bench.,
2345804,291,182,45,65,a pink bag,
2345809,9,0,444,348,Bananas on a table,
2345819,11,0,410,374,Girl flying a kite,
2345820,98,14,7,10,red letter on sign,
2345824,101,75,395,226,Young children playing baseball.,
2345831,119,171,252,326,leg receiving stitches,
2345834,224,215,252,115,brown three cushion sofa,
2345835,157,85,227,242,A bright green stuffed bear,
2345837,214,98,234,147,this is a train,
2345839,11,48,288,451,a woman riding a motor scooter,
2345842,148,77,87,34,large clock setting up high,
2345856,131,88,156,135,Purple hit in the sky,
2345861,1,140,394,233,A golden brown bun.,
2345866,41,130,456,117,the cows are black and white,
2345869,72,193,164,235,brown boat in water,
2345875,0,26,495,471,a box of colorful doughnuts,
2345883,308,61,65,70,side of yellow forklift,
2345885,26,59,471,275,a red food truck,
2345888,131,183,235,95,the sheep are close together,
2345893,120,45,95,96,a child in a bed,
2345904,102,42,137,75,Eye glasses on sign hanging from building,
2345910,60,174,130,44,Yellow paddle with black stick,
2345916,338,172,86,95,tower,
2345917,154,230,52,40,kite,
2345920,160,52,223,292,the statue is a woman,
2345921,283,183,32,13,red feathers under the wind,
2345928,176,310,196,159,the kite is on the ground,
2345938,153,91,71,21,this is a woman,
2345944,100,317,11,47,THAT IS AN EYE,
2345949,1,0,498,305,A background of cloudy sky.,
2345954,222,203,177,113,Sandwich cut in half,
2345961,206,20,92,161,skier flying through the air,
2345962,207,124,172,217,Green cooked broccoli,
2345966,175,138,138,169,the man is skateboarding,
2345968,43,26,241,180,Man doing skateboarding trick.,
2345974,86,101,242,190,a train on the tracks,
2345975,15,30,182,225,The starbucks coffee cup,
2345981,161,182,62,58,this is a skier,
2345982,32,76,181,138,this is a man,
2345984,115,140,209,172,cat is sitting down,
2346002,330,37,92,157,a window with a gray curtain,
2346004,127,190,26,67,red and white carton on the counter,
2346014,159,75,287,259,the elephant leans against the pole,
2346016,232,188,220,120,Black and brown bear,
2346018,427,271,71,60,the car is blue,
2346020,160,49,50,84,a pepper shaker on the table,
2346021,237,134,19,30,white letter on green wall,
2346029,112,21,75,210,man tossing baseball,
2346030,191,65,267,303,this is a man,
2346031,74,89,119,119,soccerball in mid air,
2346037,5,178,252,216,two elephants standing on a ground,
2346042,330,0,55,30,white clouds in blue sky,
2346044,223,52,45,43,green numbers on the bus,
2346048,151,130,205,55,a seal is laying on a bench,
2346049,208,198,155,79,horse grazing on grass,
2346051,196,262,40,37,a dish with bread,
2346053,141,55,39,47,clock,
2346057,109,246,98,76,brown calf,
2346058,309,51,108,102,the head of a man,
2346059,40,284,36,17,big framed women's sunglasses,
2346063,92,131,155,235,a yellow fire hydrant,
2346068,85,33,58,42,Small black TV that is on,
2346069,240,191,200,142,Blue and white boat on the water,
2346072,271,94,68,73,the man has long hair,
2346079,105,0,133,481,a woman riding a horse,
2346082,83,55,122,159,person wearing red hat,
2346086,3,35,427,339,a black and white dog with a cap on his head,
2346087,150,240,67,36,a truck waiting at an intersection,
2346091,9,329,293,85,white line painted on court,
2346095,144,21,6,4,white dot on shirt,
2346103,65,17,25,20,a recessed light in the ceiling,
2346104,281,168,137,145,large puffy chair to the right of the room,
2346110,42,66,310,195,Two skiers in a race.,
2346111,139,160,96,77,THAT IS SHEEP,
2346112,118,135,145,312,A tennis player preparing to hit a ball,
2346113,327,104,137,170,tan teddy bear sitting on rock,
2346117,437,149,47,43,red and white stop sign,
2346119,66,1,432,120,A rainbow colored umbrella.,
2346120,287,215,25,30,Green seasoning on pizza.,
2346122,103,15,287,297,two men playing ultimate frisbee,
2346123,9,191,480,175,water and sand in beach,
2346124,202,178,224,190,a glass topped coffee table,
2346125,19,112,247,340,the man is smiling,
2346126,71,12,309,285,A zebra standing next to a tree log,
2346128,205,168,52,93,Black hand on clock.,
2346132,245,333,54,59,white snow on ground,
2346133,18,173,386,184,quesadilla on white plate,
2346136,403,151,9,49,part of the sea,
2346140,138,41,232,236,a large cow,
2346141,297,56,50,57,red and white sign,
2346142,13,0,360,129,Green and yellow tile,
2346147,394,93,105,147,four bladed airplane propeller,
2346149,32,15,362,444,Old brown teddy bear,
2346152,179,214,32,14,Burned food on side of pan,
2346153,95,332,246,124,blue boat,
2346159,209,91,64,209,small girl throwing frisbee,
2346161,130,220,98,140,The rim on the tire is blue.,
2346163,60,60,401,303,yellow plane on top of pillar,
2346167,0,58,316,142,a blue surfboard,
2346173,144,101,103,45,windshield on the bus,
2346174,85,276,45,37,broke wood on ground,
2346177,446,248,6,5,part of a field,
2346178,50,40,269,258,the head of a zebra,
2346179,244,30,226,271,a person holding an umbrella,
2346180,460,168,39,23,Back end of red truck,
2346183,207,173,182,154,Baby zebra in the forefront.,
2346191,1,163,353,336,Red blue and white train,
2346192,41,227,25,32,dark spot in water,
2346199,403,105,25,42,ski marker in snow,
2346213,99,370,19,15,green leaf on plant,
2346216,151,4,237,240,face of black cat with gree and gold eyes,
2346220,0,2,330,491,People are at a tennis game.,
2346221,0,0,495,372,The view of a street.,
2346229,196,137,138,96,train on the track,
2346230,207,84,75,45,a yellow baseball cap,
2346243,243,184,65,95,An animal on the beach,
2346244,147,30,102,202,Light house is lit up,
2346246,228,68,27,35,red picture on fridge,
2346253,213,92,128,82,kite,
2346254,260,50,200,262,man playing tennis,
2346258,0,77,341,211,small pizza on a plate,
2346268,134,156,65,64,black and white sheep,
2346270,268,132,216,272,This is a pork fritter sandwich,
2346276,220,112,68,52,The surfboard is white.,
2346286,92,70,252,272,Couple sitting on the bench,
2346287,400,209,96,96,Silver car parked near curb,
2346290,6,168,271,330,Man wearing a shirt,
2346298,392,308,17,15,part of a rock,
2346302,23,311,22,18,a red sign on the left,
2346304,262,314,55,25,a woman's tennis shoe,
2346307,10,12,461,301,destroyed tiled bathroom,
2346314,227,183,60,43,The cow is facing forward.,
2346318,1,280,498,67,a small wire fence,
2346321,32,40,430,271,Popovers in a pan.,
2346322,84,122,370,124,partially made egg salad sandwiches,
2346327,244,12,197,307,man standing with elephants,
2346328,142,157,128,78,brown horse,
2346333,91,110,402,157,Horses pulling a cart,
2346341,196,6,117,137,blue and white kite,
2346343,133,187,72,78,a large blue crane a barge,
2346348,288,0,117,117,a thin small tree with red leaves.,
2346349,331,174,97,107,black and white dog,
2346352,268,164,117,65,laptop opened on the laptop,
2346362,233,128,60,316,a long tail of zebra,
2346366,111,65,168,174,white seat of a toilet,
2346370,11,260,25,1,brown mud on the ground,
2346376,172,25,174,190,A man sketting on a slide,
2346380,457,184,6,20,side of a wall,
2346381,129,140,160,150,BLACK ADDIDAS SHOES,
2346384,398,380,32,35,part of a mirror,
2346386,4,83,328,415,A man holding a phone.,
2346392,229,160,222,130,Yellow banana on the table,
2346393,43,53,90,75,small kite in the air,
2346394,1,180,52,122,sleeve for long sleeve shirt,
2346396,160,127,126,84,white towels in the bathroom,
2346402,42,95,439,303,GRAY A10 WARTHOG ON TARMAC,
2346404,33,118,406,250,a plane on the ground,
2346406,13,20,472,17,the grey sky behind the building,
2346408,248,471,25,24,part of a garden,
2346410,172,28,94,43,a small grey steel bench.,
2346412,341,139,43,69,person on a horse,
2346416,435,239,22,23,rock on the ground,
2346421,109,73,305,253,a man on a surfboard,
2346427,298,60,50,99,MAN SURFING ON BOARD,
2346429,19,160,162,213,Child wearing a shirt,
2346430,274,3,96,53,white clouds in blue sky,
2346440,79,199,84,64,a girl is kissing a boy on a bench,
2346442,204,2,239,321,man texting on cell phone,
2346444,8,110,25,15,Man has short hair.,
2346447,0,18,382,300,tooth brushes in a cup,
2346454,116,100,32,53,A big city clock,
2346458,10,7,489,274,train cars,
2346460,234,164,14,26,the light is yellow,
2346462,30,125,445,207,Frito Lay van in a parking spot,
2346470,389,124,60,47,sails are down on sailboat,
2346482,40,269,27,30,A white tissue role,
2346485,141,3,202,326,young boy with blue eyes,
2346486,27,4,453,370,group of people looking at television,
2346488,6,12,488,357,a bag shaped like a dog,
2346490,309,56,58,191,tower,
2346492,76,53,323,276,men on a baseball field,
2346497,132,31,124,132,Toilet paper on the shelf,
2346509,315,69,91,24,man is wearing glasses,
2346511,287,343,34,58,a billboard on the side of the road,
2346512,138,64,59,48,pointy white ear of giraffe,
2346514,256,275,32,69,Man has long gray hair.,
2346515,78,239,51,103,Girl is wearing black pants.,
2346517,123,7,120,64,leaves of palm tree,
2346519,160,62,167,177,An adult helping a child learn to ski,
2346520,81,147,134,139,Phone on table,
2346522,221,105,61,83,a man using a cell phone,
2346523,14,36,466,267,two sheep are grazing,
2346524,92,95,46,26,a yellow school bus,
2346529,160,27,72,30,white frisbee in the air,
2346530,20,211,368,162,white dotted lines on the street,
