image_id,X,Y,Width,Height,English_text,French_text
2370304,158,9,337,328,two baseball players in uniform,
2370310,11,163,36,61,american flag in the bed of the truck,
2370315,140,131,195,285,a wakeboard,
2370318,60,4,398,315,a public service bus,
2370327,82,97,240,175,the bear is brown,
2370331,37,74,360,212,a cat sitting in a bowl,
2370341,122,167,187,182,tan and white teddy bear,
2370347,270,222,34,30,A nut on the hydrant,
2370356,190,236,15,25,silver ring on the thumb,
2370362,250,161,73,22,This says \gambier\.,
2370364,178,310,67,42,this is a table,
2370369,11,273,157,95,Dell computer mouse black and silver,
2370370,24,7,470,307,People drinking,
2370372,322,178,155,202,milk sitting in the door of the fridge,
2370374,93,24,264,112,black hat on the man,
2370385,142,119,193,157,This is a zebra,
2370386,405,80,34,46,part of a tree,
2370387,0,175,153,179,this is a car,
2370388,306,220,17,16,a small green tennis ball,
2370410,4,12,204,185,This is a toilet,
2370417,70,20,314,100,These are street signs.,
2370419,238,36,259,135,this is an elephant,
2370420,235,119,35,89,the surfer doing a trick,
2370427,126,60,321,122,boy with surf board in th water,
2370438,25,132,95,117,red and blue graffiti,
2370441,337,112,73,60,truck next to the motorcycle,
2370442,101,233,126,140,man is wearing an apron,
2370443,12,96,233,237,Two men sitting on a bench.,
2370444,76,23,287,52,this is the sky,
2370447,425,288,63,40,White birds in the photo,
2370459,253,172,168,70,green eyes of a cat,
2370464,76,36,171,219,a kite flying in the sky,
2370468,169,175,73,90,clock in the photo,
2370484,209,132,56,106,A red door on the side,
2370486,36,88,449,122,Public transportation in Germany.,
2370487,124,126,56,67,the shirt is green,
2370489,180,135,67,74,person in the window,
2370491,0,97,484,234,A long locomotive on tracks,
2370492,38,14,377,253,Small kitten sleeping,
2370493,6,59,288,438,a man,
2370497,190,100,107,165,a man holding a surfboard,
2370499,111,44,135,136,an open laptop computer,
2370502,299,206,21,34,kite flying in the sky,
2370503,51,58,390,141,girl is throwing frisbee,
2370506,59,233,190,110,grey bench on sidewalk,
2370508,9,157,457,196,a dog in middle of the legs of a person,
2370510,274,125,38,32,giraffe's eye is black,
2370512,81,194,35,61,person wearing a green shirt riding on a horse,
2370519,328,89,67,95,A red stop sign in the rain,
2370521,207,335,46,111,a woman riding a bicycle through a shopping mall,
2370524,46,137,361,92,three guinea hens,
2370528,103,207,301,153,Light blue motocross bike,
2370530,156,202,98,296,a woman standing in front of a bus,
2370532,242,268,32,31,Tennis ball is in the air,
2370542,217,399,156,100,a blue place mat on the kitchen table,
2370545,140,73,122,295,man in a red jacket,
2370546,4,7,345,365,A bunch of large vases with lovely flowers,
2370555,1,32,459,222,fruits on display at the market,
2370561,52,40,363,287,Man wearing a suit and tieसूट और टाई पहने हुए आदमी,
2370562,118,131,150,115,people on the back of the elephant,
2370569,38,101,452,215,A cow is relaxing in a pasture,
2370572,214,247,43,28,a boat in the water,
2370579,74,37,383,392,a woman on a surfboard,
2370582,170,338,251,36,white lines painted on a road,
2370591,271,74,226,300,baby sleeping with bear,
2370593,158,38,228,205,person on a surfboard,
2370595,1,0,497,97,a clear blue sky,
2370597,168,133,200,102,A man riding a motorcycle.,
2370603,31,48,425,240,an elephant and a heron,
2370604,151,357,195,109,carrot is orange in color,
2370607,156,13,70,58,the hat the guy is wearing,
2370608,146,99,23,48,blue tile on the wall,
2370612,88,121,207,93,a sign for the Royal Observatory Greenwich,
2370615,316,120,168,133,Blue and green bus,
2370616,150,73,246,221,The man is skiing,
2370619,76,85,363,270,french toast and bacon on a plate,
2370620,173,13,236,344,man on bike walking his dogs,
2370622,237,183,90,82,The fruit is orange.,
2370632,248,343,55,59,the zebras tail,
2370634,220,122,47,28,Brown fur in the photo,
2370637,215,198,63,80,white sink in the bathroom,
2370640,76,52,215,446,Two giraffes near each other,
2370641,75,145,10,52,white metal pole with red stripe,
2370643,2,13,470,304,Two people leading horses,
2370647,164,3,335,371,A dog wearing a hard hat,
2370655,78,20,297,311,a toddler holding a teddy bear,
2370658,1,116,364,295,a doughnut on cardboard,
2370659,28,90,377,235,A dog and a cat,
2370660,145,94,141,143,Dog with a collar on,
2370662,280,178,68,65,cooked green broccoli crowns,
2370672,226,150,118,140,piece of the pie,
2370684,161,49,30,56,green and yellow streetlights,
2370685,250,46,203,110,a fluffy teddy bear on a bed,
2370693,139,59,97,89,Stuffed teddy bear on fence.,
2370696,104,122,332,288,a boy looking at the camera,
2370705,251,118,206,95,Open book on a person who is sleeping,
2370708,242,139,20,30,white surf board in hand,
2370709,26,387,43,110,silver spoon on the table,
2370710,73,160,54,98,white dog on bench,
2370713,5,57,470,220,The man is enjoying waterskiing,
2370718,292,160,39,25,logo of TV channel on screen,
2370719,2,1,495,155,clear blue sky over snowy mountain,
2370720,227,101,27,41,the man's grey cap on his head,
2370728,210,133,56,75,Silver faucet in bathroom,
2370732,0,283,187,21,reflection of the light,
2370733,15,96,36,15,word pizza on sign,
2370735,321,57,51,51,red umbrella in the air,
2370739,113,23,142,304,a man tying his shoe,
2370741,32,269,53,130,White cabinet next to white fridge,
2370745,143,176,319,85,the white lines on the tennis court,
2370750,262,140,212,65,A yellow bus parked,
2370752,275,230,86,46,rainbow striped rectangular rug,
2370754,308,99,112,100,Brown wooden bench on pavement,
2370757,212,181,111,51,Quilt with basket pattern,
2370763,221,161,65,46,turbine engine under plane wing,
2370766,83,13,119,119,TED THE TEDDY BEAR MOVIE STAR,
2370775,332,134,26,25,Painted red screw on scissors,
2370776,119,32,183,120,a woman wearing sunglasses,
2370779,53,75,352,190,the train on the track,
2370784,290,188,51,15,small white motorboat,
2370797,70,272,40,79,A partially used jar of honey.,
2370803,241,243,182,130,Light brown wooden wood that has been stained.,
2370811,183,139,134,144,This is a picture of a bird.,
2370812,238,133,108,77,white flowers in the suitcase,
2370820,8,19,297,471,little boy with short brown hair,
2370839,205,383,122,112,red metal frame of a bicycle,
2370842,305,12,130,151,American flag flying in the distance,
2370845,203,49,274,122,wet brown dog,
2370849,239,198,17,21,edge of a tusk,
2370850,91,147,313,185,sheep in a field,
2370855,221,237,79,85,Black and gold clock built into building,
2370857,92,272,253,134,Air Tight Cellophane Covering,
2370859,1,20,291,297,grey and white cat,
2370860,76,127,227,152,multicolored presents on a stand,
2370863,163,20,114,45,The sign is white.,
2370868,0,0,499,125,bright sunny blue sky,
2370869,200,197,96,78,black and white striped zebra,
2370873,110,6,61,61,fork stabbed in food,
2370880,136,91,42,70,man sitting on top of a wagon,
2370881,295,22,85,225,tall building with blue windows,
2370884,37,122,220,111,two dogs resting on the ground,
2370889,113,223,27,44,Wheel in the photo,
2370895,330,205,30,16,tire on the pallet,
2370897,186,185,48,44,The truck has a UPS symbol on it,
2370900,310,193,127,128,The front tire of the bike,
2370903,176,192,129,99,pitcher throwing a ball,
2370904,440,331,33,50,tip of a lit cigarette,
2370905,4,68,277,180,train on left side,
2370908,76,52,25,38,A blue apron in the photo,
2370912,10,88,479,142,a blue train car,
2370917,94,140,140,134,Six white sea gulls are standing.,
2370921,135,20,186,108,The sky has some clouds,
2370928,128,41,342,231,Broken segments of green glass,
2370929,166,109,332,212,Couch in a room.,
2370932,199,45,52,75,a television with a video game playing,
2370934,130,174,45,23,black stripes on a zebra,
2370937,359,106,44,77,large scale on boat,
2370939,163,202,146,163,This is a feline.,
2370940,402,142,80,74,man riding a bicycle,
2370941,80,2,204,496,Man standing in the doorway of a firehouse.,
2370945,151,123,90,117,a man sitting down surrounded by fruits,
2370954,48,48,221,259,a pair of legs,
2370957,1,183,260,132,bed is not made,
2370958,3,118,269,235,a man riding a motorcycle,
2370960,34,258,7,20,the red hanging earring,
2370968,110,116,286,212,a cop car on the raod,
2370971,1,34,307,297,a woman sitting on a bed,
2370972,50,215,126,128,a 25MHP traffic sign,
2370974,45,28,349,87,the sheep has many windows,
2370975,41,46,45,45,bunch of hanging bananas,
2370978,280,66,77,167,zebra in white snow,
2370986,74,36,255,285,a man performing a stunt,
2370987,0,20,498,307,a meal eaten for dessert,
2370989,309,413,10,19,yellow flower on tree,
2370990,4,24,249,290,a blender with no top,
2370994,147,259,135,45,white cloth on wood bench,
2370997,172,78,115,141,bird etched into pot,
2370999,252,169,79,31,a one way sign,
2371000,245,109,67,118,black and white striped zebra,
2371003,79,209,153,126,a white toilet tank.,
2371004,5,3,483,180,several sailboats at a pier,
2371009,250,160,42,34,Green kite flying in the air.,
2371010,134,30,274,279,a man standing up,
2371015,117,154,154,174,Clock on the statue,
2371018,425,288,64,44,red and white destination sign,
2371022,15,61,460,222,a red truck parked,
2371023,110,57,27,107,Blue leash on the ground,
2371025,192,174,237,242,the shirt is white,
2371033,179,86,171,192,red and white stop sign,
2371034,164,0,332,372,man with knife in hand,
2371036,29,33,375,173,bear with claws at river,
2371037,53,320,309,159,large spoon on top of a plate,
2371043,69,47,217,396,woman wearing short purple dress,
2371045,222,161,70,82,yellow and black shirt,
2371047,207,224,28,30,Silver zipper on luggage,
2371048,2,85,458,170,modern train on track,
2371055,118,57,112,243,the man standing in front of the stove,
2371056,131,228,45,44,the number is 685,
2371062,421,215,61,121,The man is standing.,
2371065,355,60,105,115,The building is brick.,
2371068,252,150,23,15,lights on the top of a train,
2371078,301,198,182,67,tigger handle of toothbrush,
2371082,155,57,210,263,\A cat is pictured here\,
2371087,39,32,427,264,pale pink exterior of movie theater,
2371089,52,109,236,212,dark red teddy bear,
2371110,128,103,190,168,man surfing in rough waters,
2371113,193,147,151,339,red and yellow fire hydrant,
2371122,361,261,98,72,Two red mugs on the bathroom sink,
2371128,135,87,19,23,The Man's Nose,
2371133,186,81,207,249,six 20 dollar bills,
2371134,165,108,180,148,A tray full of round donuts.,
2371135,43,47,406,245,two beautiful giraffes,
2371139,194,4,186,312,woman walking with dog,
2371141,173,102,78,60,black and white knee pad for the right knee,
2371143,190,138,308,162,Three elephants walking,
2371145,230,418,101,46,THE SHADOW IS ON THE PAVEMENT,
2371151,183,80,81,67,man surfing in black wet suit,
2371154,71,184,110,120,person riding snowboard in snow,
2371158,296,209,200,119,Forehead of Adult Elephant,
2371160,216,420,65,42,the shoe of a man,
2371169,191,127,53,24,Inside of the ears are brown.,
2371172,156,250,64,21,it is a girl wearing pink glasses,
2371177,188,332,44,55,A surf board in the water,
2371183,419,89,20,40,a man on the beach,
2371188,8,12,455,349,Girl carrying a surfboard,
2371189,187,210,120,86,man in purple shirt,
2371191,188,158,40,49,chair with arm rests,
2371194,105,100,45,51,gray and black wall tiles,
2371197,147,271,149,195,The man is wearing a striped tie.,
2371198,27,0,467,77,green leaves on trees,
2371205,4,165,42,38,long white public transit bus,
2371218,39,112,433,205,a city bus on a street,
2371219,51,275,447,110,silver spoon on a white plate,
2371231,84,190,42,57,Three people riding a motorcycle,
2371236,64,140,96,182,Woman walking through airline terminal,
2371239,0,83,281,246,a wood bench,
2371245,104,53,299,225,two elephants playing with each other,
2371246,3,3,371,493,A donut and a cup,
2371249,295,248,60,33,Two eyes glowing like lights.,
2371255,25,38,152,79,green and white sign,
2371258,67,351,44,103,A bright red fire hydrant.,
2371261,103,446,201,48,THE HORSES HAVE HOOVES,
2371268,168,55,200,240,Black Great Dane dog sitting,
2371271,0,0,496,372,going for car ride with cat,
2371274,345,234,152,117,empty seats with orange backs,
2371280,29,48,427,319,this is a public event,
2371286,244,62,191,244,red and white stop sign on post,
2371290,25,10,36,96,tall pines tree with snow,
2371292,101,209,142,161,man with black pants,
2371293,87,136,51,25,cheese and sausage on uncooked pizza,
2371297,318,206,58,20,a white base,
2371300,166,321,50,21,A logo is written on the neck tie,
2371307,32,301,236,174,a woman sitting on a bench,
2371308,0,136,485,131,The water is churning.,
2371312,347,136,47,68,A little girl in a red outfit.,
2371322,41,70,437,238,Black and white zebra walking on green grass,
2371323,54,118,410,145,An airplane flying in the sky.,
2371329,129,271,72,72,A black and brown clock face.,
2371334,41,49,410,297,a motorcycle on the street,
2371336,18,68,452,135,red and white airplane in air,
2371340,128,119,237,191,bear facing towards camera,
2371342,0,5,482,365,Woman and three girls seated at the table.,
2371347,11,136,185,230,this is one of the three trees pictured,
2371355,182,92,70,91,Clock on the tower.,
