image_id,X,Y,Width,Height,English_text,French_text
2374492,144,76,168,399,A kid standing on the end of a skateboard,
2374496,94,222,72,62,a large pile of tangerines,
2374499,0,0,372,495,Daytime near the ocean.,
2374503,16,135,165,161,white motorcycle parked,
2374506,321,61,174,172,A very old green bus,
2374509,109,1,365,328,a woman laying on a mattress,
2374510,39,39,155,47,vegetable on the floor,
2374511,19,33,475,255,a commercial blue and white truck,
2374513,142,26,160,230,A bear by a fence,
2374521,156,52,270,317,silhouette of person with kite,
2374522,198,191,45,62,little brown teddy bear,
2374523,329,240,48,85,a blue decorated vase,
2374531,246,165,136,155,baby elephant under its mom,
2374533,311,86,26,19,window pane in window,
2374534,40,6,415,256,zebra in the field,
2374535,128,126,296,163,the bus on the street,
2374536,135,9,133,102,A girl on a horse,
2374537,213,172,252,153,mountains covered in snow,
2374539,14,191,305,301,plate full of food,
2374541,0,149,208,217,broccoli on the plate,
2374547,476,179,17,22,white vehicle parked,
2374552,140,222,168,126,clock on the side of the tower,
2374558,243,124,81,117,the lamp on the table,
2374565,164,382,13,23,A greenish wrist band,
2374572,41,10,306,469,man kicking a ball,
2374573,144,257,45,92,little girl on the beach,
2374580,86,104,78,132,the broccoli is green in color,
2374582,97,36,231,228,two people riding horses on a beach,
2374583,3,104,149,285,shadow from the vase and the flowers,
2374587,353,115,43,54,Individual is on a surfboard.,
2374591,144,163,262,28,A magnetic silver strip on the wall.,
2374599,262,42,17,23,round blue sign,
2374602,52,121,237,240,black and white cat under a backpack,
2374607,93,42,376,286,Skiers are on a snow covered road,
2374609,188,101,310,200,two people cross country skiing,
2374613,302,138,90,103,bunch of ripe bananas on right,
2374619,102,97,226,401,light yellow fridge with wood trim,
2374624,81,40,182,368,man is riding a motorcycle,
2374630,55,33,257,341,man skiing on the snow,
2374631,390,163,32,50,air freshener on a toilet,
2374633,41,84,140,217,A MAN PLAYING TENNIS,
2374636,4,76,361,317,a man skiing down a snowy slope,
2374640,360,116,119,93,a small furry dog,
2374646,65,10,368,388,airplane in the sky,
2374647,123,28,287,344,woman petting a black cow,
2374651,351,74,92,232,green and white street sign,
2374655,155,156,105,33,The girl has eyes,
2374660,133,78,52,174,long black colored tie,
2374661,177,181,278,67,the long red surfboard,
2374668,115,120,97,228,A striped gold shower curtain.,
2374673,40,1,401,271,giraffe in it's natural habitat,
2374681,74,173,158,107,man sitting on a bench,
2374682,60,18,421,269,Picture taken outdoors,
2374688,184,230,12,10,the 90 on the front of the train,
2374689,101,30,397,287,Men playing baseball,
2374692,6,279,229,50,a chain link fence,
2374705,279,122,62,23,train number is 34046,
2374706,55,167,69,34,some type of brown sauce in white bowl,
2374710,103,74,111,71,American flag on a building,
2374712,6,32,480,437,A breakfast burrito,
2374713,11,144,472,185,numerous boats in harbor,
2374714,38,72,440,259,a red truck with its hood up,
2374718,151,73,147,137,blue t shirt on man,
2374719,311,221,55,22,the cake is white,
2374720,64,174,192,192,A white poodle,
2374723,230,35,175,191,A Golden Retriever on bed,
2374724,60,375,132,123,a person holding tennis bat,
2374732,213,150,66,100,a giraffe walking in a wildlife park,
2374735,52,133,75,81,red and white stop sign,
2374737,245,83,178,291,a girl sitting on a bed,
2374738,20,53,355,309,gathering of young men,
2374739,171,199,87,77,man riding horse,
2374752,111,26,320,312,a baseball player hitting a ball,
2374756,1,0,497,222,The sky is blue.,
2374760,112,80,234,336,two women on a tennis court,
2374761,31,73,252,425,silver colored fire hydrant,
2374762,11,4,462,327,Picture taken indoors,
2374763,172,108,40,42,brown colored town clock,
2374766,379,241,43,12,part of an ocean,
2374767,402,205,32,13,part of an ocean,
2374769,49,267,23,54,Small pink bottle,
2374778,17,67,473,218,donuts on a white plate,
2374786,7,31,208,200,Shoes on a skatebroad,
2374787,16,72,307,161,the umbrella is black,
2374791,7,1,489,212,The plate is oval.,
2374798,51,61,176,125,dog wearing a cone,
2374800,46,167,132,314,boy is flying kite,
2374807,20,0,234,242,a man smiling,
2374815,84,47,46,41,bunch of bananas hanging,
2374821,45,47,424,164,a small white red and grey plane,
2374824,383,269,115,60,a building sitting among the trees,
2374826,386,347,20,21,part of a floor,
2374828,195,90,138,219,The man is playing baseball,
2374831,130,192,220,253,Dogs laying on the bed,
2374832,124,120,214,55,A space shuttle in the sky,
2374837,74,367,120,113,chocolate donuts covered in powder sugar on bottom left shelf,
2374848,100,260,140,105,The ground is gray.,
2374850,15,13,190,360,A man with a blue hat,
2374854,261,309,30,25,People walking outside,
2374855,112,120,14,49,Handles on a cabinet,
2374857,242,257,43,43,part of a potato,
2374862,58,145,71,202,this is a man,
2374863,222,117,44,84,a black and tan owl sitting,
2374864,74,192,200,121,man on red parachute,
2374879,211,147,227,166,people posing for photographn while snowboarding,
2374880,0,4,231,316,cat sitting by the window,
2374881,300,0,199,374,wing of a plane is tan and red,
2374885,418,302,79,30,some straw on the ground,
2374889,260,82,145,185,Small grey bird,
2374891,2,64,375,310,Person taking picture of their dog,
2374892,103,110,122,227,this is a man,
2374894,85,77,314,261,these are two zebras,
2374896,216,254,226,47,Snowboard under a man,
2374902,79,36,35,54,this is a man,
2374913,249,50,97,62,Man wearing tan hat.,
2374920,166,65,62,41,Black sticker stuck on pole.,
2374922,93,6,355,300,large silver spoon,
2374929,37,203,41,84,pink bear on a shelf,
2374932,136,398,5,9,part of a wheel,
2374939,300,120,81,143,white sail on the book,
2374940,306,28,148,117,this is the sky,
2374941,198,61,46,47,The sky is blue.,
2374942,250,216,48,55,Mirror on a swivel mounted to the wall,
2374944,429,101,35,48,the face of a person,
2374946,138,90,32,25,Person has short hair.,
2374949,5,125,105,116,green leaves with some holes,
2374950,240,56,15,15,The sky is grey.,
2374954,198,41,65,65,a kite in the sky,
2374964,97,71,401,206,the train is dark inside,
2374965,55,80,125,80,shadow of the tree,
2374971,144,25,233,106,The sky is blue.,
2374972,69,55,222,392,The girl is a baby.,
2374977,198,137,37,55,Soda can sitting on the table,
2374978,94,189,56,23,red hour hand on a clock,
2374979,214,31,142,261,a man holding a wine glass,
2374981,130,112,297,231,White truck in road.,
2374986,129,155,135,55,The colorful sofa in the center of the room.,
2374991,173,32,92,108,a skier coming down large slope,
2374992,165,71,128,428,man with curly short hair,
2375002,26,5,270,489,A large brick column,
2375003,391,0,105,237,a bottle of hot sauce,
2375004,209,140,104,142,three blue tennis rackets,
2375005,165,70,290,245,A train is on railroad tracks,
2375006,7,311,95,140,Blue front of passenger train,
2375009,201,248,85,64,Brown horse in field,
2375010,33,99,322,166,A silver train on tracks,
2375011,192,150,132,130,Brown mud on a field,
2375023,209,137,188,175,this is a steering,
2375025,312,200,16,37,lady walking down the street,
2375040,287,27,95,144,a toilet paper dispenser,
2375041,313,38,130,245,a black cabinet with white doors,
2375043,243,17,55,35,The lights are on.,
2375050,163,275,44,42,Feta cheese next to black olive,
2375057,54,168,83,90,Woman's beige hand bag,
2375065,446,103,39,42,Green banana on table.,
2375066,194,118,101,35,the letters are yellow,
2375067,134,385,90,11,A base plate below the batter,
2375069,0,1,498,137,bright blue sky with a few clouds,
2375080,6,99,272,232,Two people are dressed like a camel.,
2375081,220,194,48,53,A bald man,
2375082,13,42,270,267,Cricket players playing cricket,
2375090,180,267,75,115,Asparagus is green in color.,
2375096,182,72,140,98,this is a cat,
2375097,223,111,234,129,A brown cat inside a kitchen sink,
2375098,180,146,317,145,Red and black train car,
2375100,136,1,108,455,A large clock on top of a post,
2375106,59,5,255,309,the bear is white,
2375110,25,61,351,152,blue greyhound bus,
2375111,70,409,151,83,this is a skateboard,
2375116,317,256,32,50,part of a floor,
2375129,16,2,410,342,this guy is surfing,
2375130,415,275,24,51,White dashed line on the street,
2375133,203,153,20,39,black stripes on a zebra,
2375143,302,144,47,31,A brown sheep with black feet,
2375149,265,16,221,181,large black computer monitor,
2375150,25,29,469,331,girl laying in the bed,
2375151,69,25,135,304,this is a man,
2375156,221,31,85,82,girl's hair is blonde,
2375159,40,107,80,146,Blue ginger bread man on desk.,
2375167,117,51,244,314,Two childrens standing in the house,
2375169,28,25,165,346,the woman playing tennis,
2375174,15,53,64,90,cat has pink ears,
2375177,275,227,36,36,An Orange motorcycle reflector light,
2375178,186,176,66,180,a dark tie with white dots,
2375179,24,21,232,93,Dreary gray sky with no sun.,
2375181,410,115,12,12,the ring on the woman's finger,
2375182,257,86,132,139,white laptop sitting on a table,
2375183,333,15,163,77,Three hanging lights,
2375186,232,0,151,63,A man's neck,
2375192,157,294,170,193,A purple flower vase,
2375194,14,135,109,237,Gold colored decorative peice,
2375199,192,194,33,32,A giraffe's purple tounge,
2375204,59,108,249,215,This is a person,
2375212,146,124,70,90,a man holding a tennis racket,
2375220,339,355,23,53,a man on the tarmac,
2375232,136,60,160,85,The person is surfing.,
2375241,39,17,436,342,A surfer riding a wave,
2375250,209,40,45,410,Directional sign secured on pole in sidewalk.,
2375259,346,0,72,35,the lights are turned on,
2375270,174,242,72,55,small container of sauce,
2375277,3,157,496,196,a kid feeding a giraffe,
2375284,185,66,209,255,people standing in line,
2375291,119,147,146,258,man sitting on concrete,
2375294,185,95,127,97,blue cape with stripes,
2375296,103,13,148,317,boy in blue shirt,
2375301,157,91,144,157,Black and white board,
2375303,48,173,289,130,a very large hairy dark brown bull,
2375322,34,303,284,134,Four cows standing by a road,
2375329,196,29,197,292,man is making pizza,
2375331,306,30,122,118,the red STOP sign,
2375334,182,145,115,93,White and pink frisbee.,
2375344,113,2,322,371,a young girl sitting on a rock,
2375346,188,17,107,95,boy is bent over,
2375351,166,27,317,345,a bathroom gadget,
2375356,65,302,115,101,A zebra grazing on grass,
2375359,78,387,60,49,dark panel van parked,
2375360,119,263,356,207,The trail has rocks,
2375362,34,11,460,297,picture taken outdoors,
2375363,6,136,177,172,pieces of green broccoli on white plate,
2375369,186,37,275,269,Man throwing frisbee,
2375379,253,255,52,56,part of a shade,
2375383,7,174,433,155,a group of horse back riders on the beach,
2375391,66,31,341,241,A family of three giraffes,
2375392,71,83,296,38,\Take a trip on a london landmark\,
2375393,47,37,423,190,A lone plane in the sky,
2375401,171,31,82,80,A white hat,
2375410,172,223,159,158,a parked silver bus,
2375416,58,104,280,227,blue blanket in baby bed,
2375421,52,167,128,250,A group of four carrots,
2375423,140,37,210,216,The Person is snowboarding,
2375427,151,93,34,22,Clock at the top of tall tower,
2375428,166,113,82,62,the look of 'what did i do wrong? dont leave me?',
2375433,283,301,32,48,part of a trouser,
2375435,352,3,66,50,a silver toilet paper holder set in the wall,
2375436,244,150,41,112,woman wearing blue ski jacket and black pants,
2375443,0,108,321,215,darker blue and white tennis court,
2375444,81,74,327,270,the boy is wet,
2375448,209,16,118,90,clock hanging by a chain from ceiling,
2375449,46,34,302,458,A father playing video games with his son,
2375456,0,61,337,438,The container holds a hotdog.,
2375470,361,267,92,48,A zebra in the jungle,
2375472,255,55,241,200,a surfboard on the sand,
2375473,260,11,186,157,man riding a skateboard,
2375477,1,292,65,111,the tank is on the wall,
2375480,261,13,196,297,tree branches weighed down by snow,
2375482,59,217,306,231,picture taken outdoors,
2375491,67,84,41,90,Black object hanging from wire.,
2375495,321,232,52,26,white wireless computer mouse,
2375500,16,118,483,167,a thin crust pizza,
2375502,129,208,370,122,bridge going over the water,
2375504,338,288,118,141,Mouse on the table.,
2375509,7,6,460,482,a man and woman boarding the bus at a bus stop,
2375520,69,70,104,165,open door in the side of the airplane,
2375525,2,100,407,165,the plane is on the runway,
2375527,239,270,176,64,surfboard propped up against a branch,
2375528,96,192,143,161,the bare back of a woman,
2375530,271,345,13,12,edge of a guard,
2375536,14,140,484,191,Crowd of people in the rain,
2375537,193,96,82,201,person with bookbag in snow,
2375539,190,132,196,329,A gold statue of a dog,
2375542,266,87,125,215,man ready to catch the frisbee,
2375545,7,42,435,259,An old green army motorcycle,
2375550,65,91,240,52,A sign in a different language,
2375552,12,4,485,267,Two airplanes,
2375555,56,258,215,211,a small white birthday cake,
2375556,23,87,172,280,Old fashioned street light,
2375560,84,128,196,285,SEAGULL standing on iron rail,
2375564,383,272,32,28,Small part of brown murky water,
2375566,44,147,222,109,a pile of red grape tomatoes,
2375567,18,170,423,100,Train tracks through the bushes,
2375570,15,20,50,48,parking meter on sidewalk,
2375572,167,258,165,228,white metal sign,
2375574,206,181,49,81,a small table lamp,
2375576,105,256,140,117,white and red Christmas stocking,
