image_id,X,Y,Width,Height,English_text,French_text
2411332,16,228,149,232,Multiple surfboards lined up,
2411333,317,15,40,43,male skateboarder wearing black helmet,
2411341,190,15,114,106,motion blurry cat head,
2411346,153,122,153,172,A man swinging a bat,
2411360,258,142,74,16,Letters are blue color.,
2411362,9,200,112,127,two black shoes with black bows,
2411376,3,4,186,169,triangular traffic sign,
2411378,34,21,132,227,White bath towel hanging against tile,
2411379,45,129,255,317,a man in a mirror,
2411382,188,37,63,72,part of a wall,
2411398,160,381,177,75,black skateboard with red wheels,
2411399,207,167,211,90,People on a beach.,
2411403,431,227,34,43,part of a glassy part,
2411404,73,226,62,221,a white fire hydrant,
2411405,186,85,73,32,A lone kite flies in the sky,
2411407,17,153,209,77,laying zebras in a grass field,
2411417,8,37,467,320,Zebras in the zoo.,
2411418,111,16,135,65,Empty billboard sign on top of building,
2411421,29,23,464,115,lot's of signs advertising their brands,
2411423,170,20,97,310,a woman talking on a phone,
2411425,130,41,89,119,gas mask on mans face,
2411426,85,43,276,165,Male surfer riding an average size wave,
2411428,16,107,195,217,this is a man,
2411430,205,145,24,26,the man's eye ball,
2411435,312,266,37,19,Number 110,
2411440,17,205,292,282,Picture is taken outside.,
2411441,14,17,109,30,Sky is blue color.,
2411442,17,159,198,313,Brown horse pulling trolley,
2411445,4,20,95,242,Man wearing glasses,
2411447,24,18,445,275,Black and white picture.,
2411448,4,4,494,357,A plate on a table.,
2411449,4,0,72,152,Light on the table,
2411456,10,10,247,478,Man riding a skaterboard,
2411463,46,28,326,238,A lot of motorcycles in the shop.,
2411464,343,27,42,47,part of a trouser,
2411468,223,295,52,12,part of a sndy beach,
2411469,243,152,59,62,woman serving tennis ball,
2411470,175,207,127,105,man is holding a camera,
2411471,199,22,75,192,a person on a horse,
2411473,133,91,338,175,red and white bus,
2411474,152,95,173,255,cat watching lg tv,
2411486,261,159,165,73,A fluorescent yellow shirt with a black vest,
2411488,129,202,22,24,person skiing down white snow covered mountain,
2411491,70,164,272,184,A white cat with a gold bell.,
2411498,305,11,94,29,Frisbee in the air.,
2411504,371,23,35,54,Spectator in red shirt,
2411524,127,256,107,68,brown wood cutting board,
2411526,228,450,8,24,bottom of a glass,
2411530,363,282,102,45,top of trash can lid,
2411532,12,292,112,26,Name of the photographer in the corner.,
2411533,64,58,430,315,A stack of animals on sidewalk.,
2411534,14,7,24,22,yellow tennis ball thrown by man,
2411545,147,60,86,97,green sliced jalapenos,
2411553,152,133,122,172,player up to bat,
2411555,53,143,58,45,blurry green tennis ball,
2411557,201,152,99,158,man holding a dog,
2411560,1,13,109,214,Person wears striped sweater.,
2411561,135,32,133,300,a man on a blue and silver motorcycle,
2411562,108,1,161,123,large green hanging leaves,
2411567,108,77,71,60,a black television,
2411569,145,116,59,143,upside down light colored umbrella,
2411571,25,18,465,306,three parked motorcycles,
2411572,176,127,118,82,Horse in the woods.,
2411575,145,34,80,255,Young boy with tanned skin and dark hair,
2411580,203,147,43,32,a surfers hand touching the water,
2411584,52,91,208,263,piece of chocolate cake in tray,
2411587,238,206,215,116,shadow of bench,
2411588,41,24,427,302,Picture is taken outside.,
2411596,13,3,472,367,bagel on white plate,
2411598,187,370,235,85,pond the polar bear is looking into,
2411604,128,245,179,61,a boat in the water,
2411619,303,125,52,80,man wearing cap backwards,
2411633,226,7,115,240,Kite with crescent moon wearing sun glasses,
2411636,217,115,82,159,woman wearing floral dress,
2411640,137,80,227,272,brown and white cat,
2411641,70,102,47,47,basketball in boys hand,
2411652,198,175,32,42,a white clock face,
2411653,53,117,179,154,young man sitting in shadow,
2411660,183,180,40,30,A slice of crispy pepperoni,
2411665,31,5,165,192,a zebra out in the woods,
2411666,1,140,495,192,the snow is white,
2411667,202,25,230,291,red trunk along the side of the road,
2411675,176,81,44,38,man inside cart of hay,
2411682,443,250,49,57,part of some dry grass,
2411684,79,147,189,105,plane coming in to land,
2411686,107,114,268,125,Four airline employees on the ground,
2411688,196,306,52,60,Motorcycle brand is named turbo,
2411694,275,197,100,44,Airplane flying in the sky,
2411695,8,144,410,215,a grassy field,
2411705,163,122,335,105,brown bear walking through woods,
2411708,122,92,230,174,A pile of bananas,
2411711,45,68,237,369,a very tall giraffe,
2411713,358,166,68,51,license plate on back of motorbike,
2411718,196,2,132,82,yellow sign with oranges numbers,
2411720,127,2,187,440,young man wearing white shirt and brown pants,
2411728,132,345,36,125,a person standing,
2411729,0,0,498,117,light and dark clouds in the sky,
2411734,94,142,34,23,shiny dogs eyes,
2411735,143,63,61,95,Orange and yellow flowers.,
2411747,69,68,65,251,Black and tan baseball bat.,
2411748,16,48,196,199,A CHOCOLATE CAKE WITH A SLICE MISSING,
2411750,335,106,164,286,People in a restaurant,
2411751,179,16,302,293,]a guy performing skate stunts,
2411752,52,117,163,182,man eating on patio,
2411761,17,9,240,386,giraffe standing in front of a brick building,
2411769,106,5,155,190,Enjoying kitesurfing with a red kite,
2411771,19,84,232,396,a giraffe standing in a field,
2411775,468,195,30,17,red hat on man's head,
2411776,37,304,117,53,rocks behind the giraffe,
2411783,348,102,17,12,green tennis ball,
2411784,113,179,51,39,blue and white circle,
2411785,238,176,52,135,Baseball player at bat,
2411787,0,0,310,262,Computer is turn on,
2411788,88,158,200,337,A MAN EATING A SANDWICH,
2411796,103,60,290,261,a fluffy black and white cat,
2411797,127,230,80,21,Small ski on right foot,
2411800,152,21,282,305,Two giraffe are shown,
2411801,438,176,46,65,red and white trash can,
2411803,47,27,67,82,Hair is brown color.,
2411809,107,31,272,288,woman holding plate of food,
2411812,217,67,153,137,apple computer screen on stool,
2411834,223,44,240,199,a batter slugs the ball,
2411835,194,11,152,342,baseball player Pierzynski,
2411844,72,20,312,303,zebra,
2411847,157,146,22,20,this is a plane,
2411848,143,42,119,253,Baseball player whose defensive position is catcher,
2411849,19,16,480,247,sunset behind a parked plane,
2411850,0,36,333,418,Plant is sparse and bare,
2411856,57,51,50,48,A large clock face,
2411867,0,25,310,196,The suit is blue,
2411873,3,72,402,232,black maker on top of an orange,
2411885,94,80,346,224,Cheese on a pizza,
2411887,47,46,440,240,Jet aircraft flying,
2411888,428,2,70,59,The photo was posted on flickr.,
2411899,58,231,45,75,A young girl wearing a pink outfit,
2411910,109,35,124,223,silver fridge with lots of colorful magnets on it,
2411911,116,113,161,61,Metrobus with a bike on the front of it.,
2411913,138,70,17,11,tennis ball in air,
2411920,30,102,168,203,skateboarder high in the air,
2411921,21,30,477,330,A picture of food.,
2411933,0,122,186,362,Chair is red,
2411935,356,11,65,82,television on a wall,
2411937,276,237,92,53,yellow frisbee on grass,
2411938,201,191,57,58,white sugar glaze,
2411945,112,13,58,48,Silver light on a ceiling,
2411946,184,180,27,28,top of gray wire fence,
2411948,155,217,39,23,The elephants trunk,
2411949,132,27,119,84,a long red kite in the sky,
2411951,129,49,129,269,man sitting on bench,
2411952,52,404,45,45,gray base on large tree,
2411953,285,172,48,41,Frisbee that is being thrown.,
2411962,25,5,385,260,One boy is skating.\n,
2411966,21,72,457,287,A picture of a work area.,
2411967,35,59,379,267,Jets flying in the air,
2411969,42,79,236,344,beef burrito cut in half,
2411971,1,3,494,246,Cows facing the picture,
2411973,204,99,68,82,Red train on a railroad,
2411975,55,30,306,453,a man posing for the camera,
2411979,8,5,480,306,Team shirts on shelf,
2411981,78,47,253,101,A grey pick up truck.,
2411982,5,32,125,82,A guidebook about Italy.,
2411987,356,270,79,64,person and a stroller,
2411995,245,135,103,21,orange words on bus front,
2411996,71,9,217,107,Light fixtures attached to the wall.,
2412008,251,77,80,164,a man swinging his bat at a ball,
2412009,40,32,126,208,this is a blue ocean,
2412014,162,105,91,192,a tennis racket,
2412016,295,44,47,21,a kite is flying,
2412018,212,31,124,235,Medium sized fire hydrant,
2412020,47,82,245,269,this is a suchi cake,
2412026,224,105,97,64,a rolex sign above,
2412027,9,101,438,135,A YELLOW SCHOOL BUS,
2412030,269,195,32,43,PERSON WEARING RED RAINCOAT,
2412031,94,250,213,249,this is a banana peel,
2412041,0,0,265,307,Red suitcase on floor,
2412042,106,112,259,132,a train with a black and yellow engine puling it,
2412044,151,51,228,225,A GRAY LAPTOP,
2412048,21,96,449,180,Airplane in sky surrounded by birds.,
2412049,5,11,425,362,the dog is sitting,
2412057,72,133,294,185,a small cat figurine in a suitcase,
2412060,52,121,415,117,three horses grazing in pasture,
2412061,16,12,364,343,Bird with black feathers,
2412064,191,88,228,219,Computer monitor sitting on desk.,
2412065,176,131,91,312,Empty champagne bottle,
2412069,233,222,102,151,feathery ostrich looking to right,
2412072,232,291,140,207,A car is stopped by a guard rail,
2412074,20,100,435,252,different animals standing in grasslands,
2412075,6,12,450,313,A picture of a bedroom.,
2412081,21,237,20,25,ball is green in color.,
2412083,279,3,95,96,A gray colored ceiling,
2412086,178,195,56,96,Parking meter is seen.,
2412091,120,20,378,215,tan and white cat,
2412092,192,407,43,88,this is a skater zone,
2412093,268,37,25,30,Man is wearing a white wrist band,
2412094,63,59,157,232,Boy is crouched down.,
2412108,176,141,152,186,shadow is cast,
2412111,9,7,266,486,A picture of a horse competion.,
2412112,104,114,270,274,this is an old photo,
2412121,72,26,370,292,white stuffed teddy bear,
2412122,20,76,182,223,mirror on a wall,
2412124,32,18,413,306,herd grazing on grass,
2412125,140,37,21,12,goggles on skiers head,
2412131,264,129,228,180,people are carrying surfboards,
2412133,40,162,32,140,The woman's black leather purse strap is over her shoulder.,
2412135,91,8,276,251,skateboarder performing jumping trick,
2412138,45,106,267,172,Two black bikes on sand.,
2412140,43,47,405,233,A very good looking zebra,
2412143,157,11,137,292,Mobil shelf in middle of kitchen,
2412147,72,36,379,292,Luggage cart is blue.,
2412152,294,21,197,137,A jet is flying,
2412161,146,242,20,30,a tennis ball sitting on the bumper,
2412169,66,139,420,145,Bus parked on a street,
2412171,90,72,322,136,this are trees,
2412172,7,18,482,312,horsedog standing outside,
2412173,216,185,25,25,a chrome sink faucet,
2412175,160,105,225,247,The people shown skiing,
2412177,376,126,58,45,seat on a bicycle,
2412178,140,53,280,245,Blue and yellow train on train track.,
2412183,3,53,155,150,Wooden headboard of the bed.,
2412184,120,367,107,103,logos on the side panel of the motorcycle,
2412189,242,243,47,72,shadow is cast,
2412194,110,145,306,170,cherubs on either side of clock,
2412195,92,35,40,15,the sky is blue,
2412198,6,1,477,392,two identical images of a woman playing tennis,
2412204,376,0,122,105,Window has white mini blind.,
2412205,332,292,30,18,white electrical socket on boat,
2412208,157,183,66,15,Yellow and black license plate.,
2412213,108,126,31,85,Open silver sharpie pen,
2412217,32,120,151,47,Yellow writing on the blacktop behind the motorcycle.,
2412222,47,170,321,82,A concrete bench.,
2412227,202,470,21,13,small clump of brown bush,
2412228,63,90,199,250,this is a suzuki bike,
2412248,254,106,195,195,Mirror on a pole,
2412251,1,0,463,364,The cutting board is white,
2412253,197,126,117,131,a black HP laptop,
2412256,170,50,310,215,a small light brown dog is laying on the sofa,
2412259,290,141,153,131,Cell phone on a notebook,
2412260,239,179,143,145,piece of meat on a plate,
2412262,67,177,170,131,a plate of breakfast food,
2412273,166,122,125,54,bury bolton street sign,
2412274,213,152,142,23,left arm of bench,
2412279,16,103,357,308,the room is not well lit,
2412282,48,20,255,458,rows of colorful silky ties,
2412287,0,236,271,70,Herd of elephants,
2412288,320,236,115,132,a black suitcase on wheels,
2412291,1,85,487,279,People playing volleyball,
2412295,125,16,310,350,A teenager surfing.,
2412300,311,7,180,308,A man playing tennis.,
2412304,193,23,300,100,Large sign with writing,
2412305,66,9,390,323,black laptop on desk,
2412314,40,32,99,134,Serving spoon in the background,
2412315,0,65,200,77,an add for pizza,
2412316,31,19,329,143,this is a bear,
2412318,139,86,107,74,Large black bear nose,
2412319,316,321,40,21,black spot on ground,
2412321,294,188,85,76,the tower is written 1995,
2412322,0,0,499,62,The trees are green and leafy,
2412323,126,254,215,126,motorcycle sitting on grass,
2412324,137,171,337,125,four boats at dock,
2412326,1,1,496,266,a sunny day,
2412329,63,30,280,255,motorcyclist is running,
2412343,65,137,66,110,Statue of man holding instrument,
2412348,26,95,353,266,vegtables seasoned with black pepper,
2412349,240,230,120,55,the tap is silver,
2412352,116,86,74,85,large piece of pepperoni,
2412353,295,31,28,30,this is a clock,
2412355,155,272,50,36,many pebbles on side of train tracks,
2412360,264,267,42,50,white square on orange side,
2412362,150,117,221,153,A train.,
2412364,43,78,288,284,man riding a motorcycle,
2412369,17,10,415,255,a yellow streetcar drives past a yellow house,
2412371,171,165,164,82,Chicken wings on the table.,
2412375,223,136,56,181,A rusty pole standing in the water,
2412378,181,212,117,40,The girl is wearing blue jeans,
2412384,281,184,65,65,the dog is black,
2412389,0,305,150,67,quilt on the couch,
2412390,14,101,308,377,The people are playing frisbee.,
2412401,72,6,228,423,There is one remote shown,
2412410,44,16,402,340,Blue television on a counter,
2412423,348,175,118,54,A RUNNING DOG,
2412430,0,135,326,297,a beautiful dog on a sofa,
2412433,3,196,90,177,Man standing on the snow,
2412435,24,6,150,65,lime green sign saying,
2412438,26,152,41,190,small white stick on table,
2412439,75,41,127,244,This is a batter.,
2412445,112,76,210,193,A kitesurfer.,
2412457,98,92,21,34,Red clock on the wall behind the door.,
2412458,286,137,207,77,Elephant on the planes.,
2412462,121,256,133,242,the clothing is red,
2412465,176,43,81,67,the man is wearing a helmet,
2412466,7,8,472,357,A LITTLE GIRL CUTTING PAAER,
2412467,68,304,221,195,a woman taking a picture of a sign,
2412473,180,11,112,264,A WHITE TOILET,
2412474,1,268,95,104,This is a toilet.,
2412475,112,353,222,116,two men in wet suits talking next to two surfboards,
2412485,92,18,300,289,stop sign on top,
2412486,226,191,24,28,yellow tag in ear,
2412492,187,41,252,121,This is a neck.,
2412494,267,26,45,90,This is a stoplight.,
2412498,114,140,30,20,the eye of a giraffe,
2412500,97,95,36,30,A baseball.,
2412503,213,23,142,276,This is a policeman.,
2412512,286,183,25,35,yellow stripe on blue shorts,
2412516,31,18,102,17,two older planes are flying,
2412518,88,228,133,77,part of a large pamper,
2412523,359,12,134,337,Pink doted umbrella,
2412524,19,59,450,230,a locomotive on display,
2412527,76,30,87,60,This is a parachute.,
2412528,1,49,324,448,Woman is smiling,
2412530,85,127,16,13,right eye of a cat,
2412536,30,37,456,335,Two people in a boat.,
2412547,60,90,337,278,this is a yellow bird on the tree,
2412555,176,170,116,136,person on a tennis court,
2412567,56,25,410,315,two children sitting on a couch,
2412571,208,162,117,161,Green peppers on the wood.,
2412574,281,247,120,91,Can below black stool laying on the cement.,
2412576,35,294,148,162,The black book in the hands of the man.,
2412580,169,135,171,71,eating a Pho Banh mi sandwich,
2412581,188,2,266,332,man holding controllers,
2412583,316,162,182,96,pebbles along the beach,
2412585,182,52,146,114,tomato with melted cheese on it,
2412589,4,136,224,313,the tennis player is running,
2412593,250,237,21,36,worker with an orange vest on,
2412595,14,105,479,147,the plane is in mid air,
2412603,19,61,156,207,Man is looking down at his cell phone,
2412611,236,133,42,185,large directional sign on edge of road,
2412620,5,5,325,479,boy wearing blue shirt,
2412629,214,297,80,57,This is an animal.,
2412630,68,184,155,102,red fire truck on roadway,
2412634,100,102,120,296,men playing frisbee on shore,
2412636,172,54,184,35,overhead white light fixture,
2412646,36,94,292,220,Truck is loaded with cylinders,
2412647,343,16,128,55,Clear sky behind the plane,
2412652,1,83,237,191,a small crowd at the circus,
2412653,28,24,337,307,policeman riding a motorcycle,
2412663,387,3,84,105,portion of a glassy roof,
2412666,59,52,181,244,two men in vests,
2412670,1,370,371,127,People walking around the streets,
2412675,181,19,220,367,The boy is dressed for baseball,
2412676,113,108,245,180,white bear leaping into pool,
2412677,0,0,499,334,It is nighttime.,
2412680,45,38,197,154,Two green apples,
2412682,25,127,161,97,large white projection screen,
2412687,103,1,378,372,Man playing Frisbee with dog,
2412706,105,37,385,350,tennis player near wire fence,
2412716,129,49,78,406,the parking meter is green,
2412720,109,32,282,191,Silver Apple laptop,
2412721,136,8,194,187,A woman is on the phone,
2412724,148,439,174,55,red and white ruler,
2412732,2,3,495,238,the sky is a deep blue,
2412734,93,243,40,37,white lines are in road,
2412738,156,234,163,183,The man is skateboarding,
2412740,0,100,125,50,steam coming of the road,
2412743,128,11,256,282,young man on skateboard,
2412750,215,152,25,30,paltry chunk o' corned beef on broccoli stalk,
2412751,273,49,69,90,a woman with long blond hair,
2412762,137,155,122,147,a surfer is riding a surfboard,
2412765,82,9,382,216,Kites in the sky,
2412766,187,31,119,87,a flat screen television hangs on the wall,
2412767,152,165,70,61,the TV is black,
