image_id,X,Y,Width,Height,English_text,French_text
2371587,126,114,207,76,a person surfing,
2371589,82,176,113,114,a boy doing a skateboard trick,
2371592,48,3,446,321,a tennis match is in progress,
2371600,81,103,65,91,the girl is smiling,
2371603,43,25,407,300,a greek vase in a museum,
2371604,220,33,278,298,Man jumping on man with orange shirt,
2371610,151,213,33,23,A very large elephant standing by a baby,
2371615,96,8,175,205,an award teddy bear on display,
2371616,98,323,33,24,gold logo on underwear,
2371617,37,56,258,416,two giraffes in a grassy field,
2371623,218,60,132,118,a guy on a motorcycle in the air,
2371635,22,2,476,277,six passenger cars on a track,
2371639,121,134,177,169,person on tan motorcycle,
2371640,203,242,146,145,a head of a cow,
2371648,5,3,132,171,A cup of coffee,
2371652,138,154,129,101,DRAGON HAS A BLACK BEARD,
2371657,161,3,327,362,black cat in a toilet,
2371666,150,177,170,79,Guy wearing sunglasses,
2371667,119,41,259,161,the signs are purple,
2371668,125,125,176,260,a male tennis player,
2371671,337,21,33,105,a modern reading lamp,
2371695,26,151,54,95,White medicine bottle on the counter,
2371697,298,202,88,45,Paddle boats in the water.,
2371698,120,145,166,276,A green fire hydrant with grafitti.,
2371702,32,106,42,49,Lamp attached to wall,
2371707,100,27,90,62,bright orange baseball cap with white writing,
2371711,468,0,30,22,pink sign in left corner says \ tru \,
2371717,41,77,36,148,blind on a window,
2371725,14,15,475,279,brown and white street signs,
2371727,94,30,175,237,A man milking the cow,
2371728,60,188,113,92,tail on red kite,
2371729,239,19,229,443,woman smiling for the camera,
2371738,190,23,111,156,smiling face of male surfer,
2371745,43,114,174,203,woman playing tennis,
2371765,80,155,261,222,A silver mixer paddle,
2371768,22,28,456,410,food items seen from above,
2371770,192,70,70,172,A man riding a bike.,
2371771,203,271,78,27,Part of a pig on the shirt.,
2371777,80,168,22,47,Man standing in the shallow Bowater,
2371780,6,16,455,290,childs play area,
2371781,110,143,133,226,a train is on the tracks,
2371789,11,7,200,266,Section of blue sky with light cloud cover,
2371797,182,74,52,74,person wearing black muscle shirt and shorts,
2371803,130,73,192,291,man in white uniform,
2371812,244,92,112,219,Red painted water hydrant,
2371816,107,170,41,20,The number three on keypad,
2371822,65,2,137,54,white paper towel,
2371828,146,272,105,94,dirt on the ground,
2371832,47,71,190,304,full glass of orange juice,
2371839,102,195,174,201,Black calf,
2371841,263,24,162,97,a man with short hair,
2371850,65,109,125,137,a giraff sitting on the ground,
2371854,112,219,35,32,spot on the giraffe,
2371863,69,35,110,196,person in the water,
2371866,175,48,87,105,skier in the snow,
2371869,259,2,202,117,some legs on skateboard,
2371872,15,287,91,44,tracks in the snow,
2371874,313,31,55,75,Silver fork,
2371876,66,13,324,220,group of people skiing,
2371878,301,127,85,41,a fan in a window,
2371879,127,68,170,341,little girl flying a kite,
2371892,110,36,255,295,woman behind pink umbrella,
2371893,208,135,17,43,A man outside a building,
2371894,1,64,310,31,Jack Daniels logo,
2371897,129,113,83,80,the face of the clock,
2371911,270,40,21,32,fall foliage on tree,
2371912,61,15,133,472,THE CLOCK IS OLD,
2371916,0,283,499,91,Brick sidewalk with dark red and brown bricks,
2371926,318,330,30,32,crack in the pavement.,
2371936,217,203,115,71,front wheel of bike,
2371943,291,333,152,95,kite in the sky,
2371947,214,311,81,161,A man walking,
2371948,142,1,55,115,side of gray traffic light,
2371949,233,90,95,39,white frame on window,
2371950,196,10,302,366,Grey cat in car,
2371954,347,152,41,56,White and brown skin patches.,
2371956,178,73,164,268,white porcelain toilet on sidewalk,
2371962,218,40,70,37,A woman with pink sunglasses,
2371963,253,360,53,67,the table is made of glass,
2371964,148,111,82,93,the apple logo on the building,
2371966,13,52,318,381,an open refrigerator,
2371969,22,89,389,239,a person sitting in the snow,
2371970,297,272,30,45,empty toilet paper roll,
2371972,0,2,499,367,Three chefs in the kitchen,
2371973,76,158,77,57,Two-way traffic sign,
2371975,262,198,34,11,A bitten brown sandwich,
2371977,246,51,187,132,The cat is orange and white.,
2371979,4,4,491,325,Bird sitting on a branch among green leaves,
2371985,126,57,28,60,red and white stop sign,
2371987,62,399,176,51,shoes with a black and white checker board pattern,
2371990,136,26,287,295,man flying a kite,
2371993,138,132,77,61,A player wearing a glove,
2371994,83,161,63,58,A boy with black hair looking to his left,
2371997,187,144,83,62,Two boys kneeling down on a track.,
2371998,216,121,43,30,Right ear of zebra,
2372007,254,30,85,47,a crystal covered tiara,
2372008,77,20,350,248,Two cats,
2372009,277,2,220,131,A blue desk in the photo,
2372014,256,148,43,69,giraffe in a field,
2372015,243,63,211,212,A giraffe in the background,
2372016,173,73,179,238,white sheep eating grass,
2372018,267,176,87,94,A brown dog leaning on a man,
2372021,67,162,26,20,white sock of guy,
2372022,46,2,382,315,woman is throwing a frisbee,
2372028,31,27,285,451,two people playing video games,
2372032,9,36,380,433,boy on a skateboard,
2372034,53,371,151,117,the pizza is half eaten,
2372035,390,89,73,79,White sandal too big on foot.,
2372037,50,78,122,25,the wave is crashing,
2372041,86,20,46,275,Fork standing in the water,
2372053,7,7,491,365,white cabinets are in the kitchen,
2372055,102,188,126,205,a grey dog,
2372062,115,15,115,212,Man skiing down the mountainside,
2372063,94,170,181,75,a red truck.,
2372064,53,0,260,180,A large steel oven vent hood,
2372066,68,30,308,270,a red double decker bus,
2372067,243,443,210,37,shadow is on the ground,
2372079,217,206,67,67,white official sized soccer ball,
2372084,1,0,497,59,The sky is blue.,
2372091,84,17,212,464,a large black and brown dog,
2372096,188,349,21,13,Green leaf on vine.,
2372098,216,110,12,64,window on side of the train,
2372099,112,74,277,72,black and white so excited sign,
2372102,94,14,254,316,woman with brown curly hair,
2372103,101,151,106,104,The clock face is white.,
2372104,30,87,435,224,black and red hot dog truck,
2372106,6,146,350,146,people riding a boat,
2372111,19,18,439,301,photograph of a train station,
2372117,106,30,296,239,a pile of fruits,
2372124,52,66,288,379,orange cat on desk,
2372134,21,249,66,48,Monkey on ground,
2372137,0,5,486,337,a tray of food,
2372138,254,206,63,167,a bird standing on a post,
2372143,327,23,109,108,kite flying low to the ground,
2372150,66,189,6,7,A red colored button,
2372154,241,82,107,140,The white shirt the child is wearing.,
2372168,0,5,492,360,This is a child,
2372171,160,27,217,95,The sign says Apliu,
2372172,31,7,98,54,man has black cap,
2372175,300,20,199,275,The red tarp on the elephant's back,
2372177,1,0,304,76,The sky is white.,
2372180,269,145,40,75,red fire hydrant,
2372181,16,88,131,81,black and white zebra,
2372193,110,166,22,40,Person walking on icy sidewalk,
2372196,5,1,490,93,blue sky and clouds over tops of buildings,
2372197,96,110,99,73,baby has thin hair,
2372198,152,22,279,257,man is playing baseball,
2372199,151,125,324,122,Elephants in the field.,
2372202,120,205,14,25,A gray bag in the photo.,
2372204,326,180,55,57,this is a person,
2372210,77,3,332,229,A red motorcycle.,
2372211,116,44,159,203,this guy is standing on a skateboard,
2372217,382,25,95,222,this is a post,
2372218,215,156,252,215,this this is an apple,
2372224,16,157,372,312,left wing of an airplane,
2372225,204,368,15,20,a bottle is sitting on the floor,
2372251,134,98,67,38,white cloud in sky,
2372253,2,15,430,261,man riding a horse,
2372258,198,109,107,99,yellow liquid egg yolk,
2372261,3,100,491,130,this is a train,
2372264,26,69,447,158,yellow bananas laying on a table,
2372269,0,377,163,120,this is a railway line,
2372271,214,115,8,16,a roman numeral one,
2372272,222,172,159,125,a wood coffee table,
2372273,41,6,440,225,a yellow school bus,
2372284,324,16,173,100,a black and white umbrella,
2372285,150,450,44,23,a slice of tomatoe,
2372297,29,43,314,221,black and white zebra,
2372299,137,51,332,322,guys standing and playing video games,
2372301,86,130,320,242,a laptop computer,
2372306,201,137,203,191,Black and white cow,
2372311,2,112,347,380,this is a teddy bear,
2372314,37,113,90,224,lit up clock on building,
2372323,59,128,260,294,sandwich is in bag,
2372324,206,2,19,241,This is a tree,
2372330,253,34,195,92,A clear blue sky,
2372332,203,93,130,247,a woman kneeling on grass,
2372333,262,319,106,54,the pillow on the bench,
2372334,2,0,239,389,this is a picture,
2372339,135,234,57,28,black adult cat,
2372344,17,27,321,468,Picture taken outside.,
2372345,0,1,195,203,two gray stones on ground,
2372347,262,347,70,130,a white porcelain toilet bowl,
2372350,8,1,349,356,The liquid is purple,
2372360,156,85,80,168,the man is sitting on the back of the truck,
2372371,0,1,497,380,a bunch of candy apples,
2372375,9,46,359,444,postcard featuring a clock,
2372376,79,25,357,270,bench on the concrete,
2372377,192,108,293,144,The train car is silver,
2372382,135,178,53,63,The man is on a motorcycle,
2372385,386,239,37,61,Wheel of a truck,
2372387,52,47,308,434,refrigerator and freezer,
2372391,9,15,479,305,the picture is black and white,
2372393,34,198,347,93,three boats near the river shore,
2372399,5,446,91,49,upc symbol at the bottom left,
2372400,239,78,32,27,this is a sack,
2372401,143,45,55,91,This is a lamp,
2372403,212,105,93,111,person on water ski,
2372405,262,118,43,80,traffic light attached to pole,
2372412,208,53,65,80,framed photograph on wall,
2372414,1,144,497,229,A non-professional baseball game,
2372417,38,184,290,276,A delicious prepared burger,
2372419,146,51,210,248,man playing tennis,
2372420,80,144,260,172,a yellow bat,
2372424,83,25,314,468,the man is skiing,
2372432,26,257,21,136,blue metal fence panel,
2372433,15,67,235,72,group of wicker baskets,
2372436,77,36,105,275,Door in the bathroom,
2372438,67,143,17,32,the towle is lime green,
2372441,57,55,180,399,the giraffe standing on the dirt in a field,
2372442,58,47,341,362,three zebras in front of a giraffe,
2372444,56,2,159,66,an umbrella over their heads,
2372445,97,178,58,103,A white toilet.,
2372459,78,112,380,307,cat laying on a desk,
2372462,374,179,106,121,A zebra eating grass,
2372463,134,178,213,145,Woman with a surfboard standing in the sand,
2372464,52,30,347,293,A ship is docked at a marina,
2372465,91,265,331,122,Reflection of red bus,
2372466,238,193,27,16,meat topping on a pizza,
2372467,2,1,485,251,The train is white and black,
2372472,65,107,225,203,stuffed animal sitting on a laptop,
2372484,158,10,134,486,the clear bottle on the table,
2372487,35,36,397,252,a truck on a rack,
2372491,250,188,23,20,picture on wall,
2372497,334,97,78,22,An elephant tail in the photo.,
2372502,71,130,155,282,Man tennis player preparing to serve,
2372503,256,128,149,182,macaroni and cheese,
2372505,178,128,130,103,lone black faced sheep,
2372511,310,134,85,222,A white dress in the photo.,
2372514,3,184,239,259,the truck is black,
2372517,42,301,152,70,Pile of sauteed onions in pan,
2372523,272,123,119,96,this is an egg,
2372529,2,155,366,339,plate with food on it,
2372531,22,299,56,74,A baby duckling,
2372535,222,127,87,57,freshly home made bread,
2372538,230,307,159,32,edge of silver fence,
2372539,105,86,76,30,woman is wearing sun glasses,
2372548,76,182,100,85,A woman's bicycle parked against the wall,
2372553,35,45,447,326,This is a zebra,
2372554,56,82,256,220,the man is surfing,
2372555,4,45,118,207,poste with red background hanging on wall,
2372557,134,47,164,172,boy is playing tennis,
2372558,349,150,20,54,man wearing gray sweatshirt,
2372569,225,152,84,140,man playing tennis,
2372572,106,84,7,7,window on side of building,
2372573,1,1,218,177,stuffed panda to the left of stuffed panda,
2372574,23,366,251,115,The ground is made of asphalt,
2372577,4,7,492,365,A street intersection scene,
2372579,120,74,138,302,rusty old fire hydrant,
2372580,164,95,100,120,A kite with a flying pig design.,
2372581,33,15,466,188,group of four dogs,
2372587,14,88,477,246,a classic antique car,
2372588,116,55,110,201,A red white and blue fire hydrant,
2372591,297,203,70,58,watermelon with end cut off,
2372597,132,116,199,379,A man dragging a suitcase,
2372606,255,227,135,85,shadow of a skier,
2372607,155,316,58,126,a white flower painted vase.,
2372613,127,43,39,32,the carrots are long,
2372614,161,167,69,55,frisbee in the air,
2372615,256,180,19,29,Bell hanging under the neck of the cow,
2372616,420,75,79,140,cow in a field,
2372617,15,66,470,251,a bench by the water,
2372620,63,234,69,59,kite above the ocean,
2372625,221,113,234,252,tennis player standing at baseline,
2372627,353,176,29,30,speck of snow in air,
2372629,340,161,40,49,white letter painted on building,
2372632,99,75,145,257,the man walking on the street,
