image_id,X,Y,Width,Height,English_text,French_text
2408352,87,40,120,128,Bunch of unripe bananas.,
2408358,18,94,291,201,rustic ceiling of crossed logs and beams,
2408359,1,70,497,32,mountains in the background,
2408367,67,5,432,325,Elephants walking in the meadow,
2408371,269,82,105,204,baseball player holding a bat ready to swing,
2408375,146,173,212,100,Green leaf of arugula,
2408377,232,194,110,57,an orange and black tennis racket,
2408380,104,141,184,55,airplane in the sky,
2408388,81,211,382,230,Banana ice cream sundae,
2408396,103,55,214,338,child in school uniform,
2408399,157,2,109,248,stone column in the background,
2408407,146,271,109,55,the floor is brown,
2408408,62,60,347,271,boys playing soccer,
2408421,126,12,247,285,tennis match,
2408425,224,102,15,20,the head of a man,
2408427,122,23,46,186,a letter is missing from sign,
2408429,97,267,65,52,A black and yellow soccer ball,
2408437,284,167,97,164,White porcelain urinal with silver plumbing,
2408439,239,114,138,180,train has 'first' written on it,
2408440,65,131,280,198,train is red and white,
2408444,5,10,323,393,Train at the railway station,
2408449,240,130,55,58,The black helmet the batter is wearing.,
2408450,1,2,497,343,people waiting at a train station,
2408451,164,174,210,127,Table with chairs on a field,
2408453,325,175,124,169,the man playing catcher,
2408457,5,100,492,119,long yellow school bus,
2408458,176,120,155,175,grey stripes across center of shirt,
2408459,122,111,243,210,time is 3:39,
2408479,62,216,347,113,Baseball mount made of dirt,
2408487,70,47,128,74,a wet dog,
2408488,275,79,129,205,A bird with black feathers,
2408489,3,165,495,116,Wooden boats in a jungle.,
2408499,333,225,92,65,Yellow shorts with slit on side.,
2408503,108,78,270,253,The letter S on a stop sign,
2408513,91,88,407,177,herd of horses in field,
2408514,35,221,90,71,FRESH GREEN BROCCOLI FLOWERETTS,
2408516,0,15,497,310,Food is inside a oven,
2408517,2,2,329,482,shirtless male jumping off a skateboard,
2408522,211,280,13,15,Black arrow on the street sign.,
2408525,261,217,15,25,a white cone on the street,
2408526,54,86,22,15,a light fixture on the wall,
2408531,65,30,200,215,woman with long hair smiling,
2408533,350,20,135,306,Left handed player up to bat.,
2408534,161,170,62,91,Giraffe licking leaves,
2408535,52,58,123,87,Left bunny ear on the man's head band.,
2408537,71,106,138,46,sign is blue with gold writing,
2408538,290,151,176,51,shadow of the cow in the ground,
2408542,25,132,42,32,The top hoop earring in the girl's ear.,
2408544,20,20,120,77,the cones are orange,
2408551,20,136,87,159,A brown door,
2408553,63,130,262,252,pizza,
2408557,313,254,97,62,a wooden bench in a field,
2408563,7,47,218,251,Woman pouring bottle of wine.,
2408567,14,180,49,40,The sign is white.,
2408577,45,33,284,377,woman walking with umbrella in public.,
2408580,3,105,369,341,Pizza of vegetables is cooked,
2408583,160,249,115,126,Double decker bus.,
2408596,338,172,82,138,person in a white ski jacket and black pants,
2408610,152,104,102,47,The woman is wearing a blue hard hat.,
2408611,132,110,144,50,white boat on water,
2408615,121,208,175,225,boat on the water,
2408617,169,321,146,116,A pair of blue and white sneakers,
2408618,100,240,57,30,yellow and black bag leaning on a bicycle,
2408619,114,115,93,278,man holding Frisbee in classroom,
2408620,25,155,40,50,The door knob is made from metal.,
2408625,145,123,199,185,A man with a black bow tie,
2408632,310,250,69,53,reflection of a light,
2408637,12,89,40,40,the plate is white,
2408638,122,107,187,225,The girl is standing on the street.,
2408639,64,24,43,113,metal lamp on desk,
2408645,27,385,83,72,the grass is green,
2408646,171,170,59,47,man's finger pointing,
2408647,225,179,148,130,Two pink pieces of candy,
2408649,189,326,29,24,man wearing long white socks,
2408656,161,51,42,37,The green beam behind the person.,
2408657,64,289,24,16,the eye of a man,
2408659,1,323,49,83,roll of toilet paper on a metal fixture,
2408667,4,81,138,61,light fixture on the wall,
2408668,243,66,112,189,skier wearing skis in the air,
2408669,348,48,122,226,light house located in water,
2408672,124,60,26,66,bulb with a glass protector,
2408677,105,15,363,87,sky filled with large white clouds,
2408678,221,125,143,145,toothpaste is blue and gooey,
2408679,1,93,194,51,destination window of bus,
2408683,0,238,332,260,a black lacquered coffee table,
2408690,208,198,57,106,alcoholic beverage in glass,
2408692,0,202,207,157,An order of french fries,
2408693,344,101,56,49,hat on a persons head,
2408695,251,78,118,198,Bird standing on fence,
2408696,0,31,488,301,People waiting on the snow,
2408703,66,126,96,147,black and white zebra,
2408705,296,132,79,115,a red haired woman's up do,
2408709,238,84,173,220,bird standing on material,
2408714,27,157,208,93,Tan and white cow,
2408718,381,97,100,126,two players on tennis court,
2408721,106,183,28,26,An off white light switch,
2408724,347,91,73,60,Two American flags hanging on the truck,
2408725,73,115,223,232,woman sitting on bed,
2408728,195,115,103,40,Front window of the airplane,
2408729,11,293,185,67,patchy area of grass,
2408730,105,31,72,45,commercial plane on flight,
2408740,200,140,69,192,maroon necktie in process of being knotted,
2408753,222,13,238,298,blue train in snow,
2408758,199,42,286,95,train is red white and blue,
2408762,207,206,43,37,Front wheel of the motorcycle.,
2408773,202,134,95,167,Boy wearing blue shirt,
2408777,162,2,94,60,Black plastic tennis racket,
2408778,161,190,83,82,snowboarder tilted to one side,
2408781,103,208,350,77,a subway exit sign in New York,
2408785,147,22,154,115,blue and purple stuffed dog,
2408790,59,169,149,206,snowboarder on edge of truck,
2408795,189,159,58,44,paint peeling from the wall,
2408798,1,2,372,496,The room is a kitchen.,
2408803,400,48,28,28,Flag of the United States,
2408807,171,450,202,48,Leaves on the ground.,
2408813,60,202,359,101,Two benches sitting next to each other.,
2408817,88,133,27,42,ball is green color.,
2408822,203,135,125,237,a man holding onto a camera,
2408833,207,361,102,60,The man is holding a cell phone.,
2408835,78,2,127,59,Wagon wheel light fixture.,
2408839,67,161,408,153,Red and white airberlin airplane,
2408849,67,1,261,106,White paper lanterns,
2408854,29,200,223,203,Pig is white and black,
2408856,21,16,459,466,four oblong decorated panels,
2408858,141,72,60,169,A green pepper,
2408865,1,0,493,362,Things on a carpet,
2408867,105,104,226,261,a man with grey hair,
2408870,13,64,464,187,The plane is on the runway.,
2408874,156,170,155,130,Cat sitting on chair,
2408877,189,94,100,49,recessed lights in ceiling,
2408884,53,220,86,53,Zebra on the ground.,
2408885,93,100,345,200,double-decker bus on road,
2408891,183,80,129,158,a green trolley car,
2408895,12,150,442,167,bent poles supporting wire fencing,
2408899,176,87,301,275,train with blue and orange details,
2408908,32,143,100,95,Water is blue color.,
2408913,138,87,61,175,man wears white tennis outfit,
2408914,25,101,422,371,The photo was taken on a ski slope,
2408916,165,136,121,136,baby wearing a motorcycle helmet,
2408918,23,163,161,181,magazines in wire rack,
2408919,277,350,80,62,A 2007 Boston Marathon runner's Bib with the number 16957,
2408923,33,85,436,230,the calico cat is multicolored,
2408932,29,69,203,164,skateboarder at top of ramp,
2408934,158,257,147,174,sitting tabby cat,
2408936,45,27,407,332,four people riding a motorcycle,
2408937,188,72,136,87,Snow on tree limbs.,
2408938,312,132,135,72,man is holding a bat,
2408939,97,0,391,325,woman playing tennis,
2408941,138,3,108,291,Wine glass,
2408942,63,112,102,192,zebra is very small,
2408943,228,245,80,93,Red cup on table.,
2408945,89,126,54,64,a man serving hot dogs,
2408947,75,79,271,295,Man wearing a blue hat,
2408951,173,224,62,51,light and dark spots on giraffe,
2408962,168,33,297,228,A WOMAN SITTING ON A BENCH,
2408963,205,295,96,30,white chalk line on grass field,
2408969,103,40,232,222,Three people,
2408973,357,274,136,39,This is black and gray,
2408976,61,30,250,465,Man holds an umbrella,
2408977,100,14,382,349,There is a pepsi cooler in the corner,
2408990,129,0,367,289,a bouquet of daisies and purple flowers,
2408991,127,88,111,303,Babe Ruth standing outside the dugout,
2408994,0,7,499,323,Elephants in a river,
2408999,95,187,98,144,Black and white cat sitting under the bench.,
2409002,142,328,158,131,red skateboard with blue wheels,
2409004,338,201,67,57,Sheep eating green grass,
2409006,148,416,41,76,a lower level window,
2409013,85,92,363,164,An Airplane,
2409015,206,8,287,311,AN ORDER OF FRENCH FRIES,
2409016,27,121,56,36,the soccer ball,
2409017,6,168,289,157,seven boats in the water,
2409019,203,23,37,37,stars on American flag,
2409020,196,124,245,207,Three ladies sitting on a bench,
2409021,0,70,168,416,lady standing in kitchen,
2409025,366,272,65,42,One candle in the middle of plate,
2409026,282,215,115,95,wood and wrought iron bench,
2409034,246,146,39,40,Black rear tire on the gray pick up truck.,
2409037,45,143,402,192,Red train stopped at train terminal.,
2409053,26,100,423,185,Greyhound bus moving in traffic.,
2409060,36,30,314,144,three colorful kites in the sky,
2409062,32,208,455,115,a lot of oranges,
2409066,36,377,146,75,This is a pillow,
2409076,187,82,52,50,red stop sign,
2409077,220,29,79,126,Woman holding microphone,
2409079,13,155,188,123,carved large brosted chicken,
2409084,46,22,157,242,head of a horse statue,
2409095,378,319,16,7,\I\ on face of clock,
2409097,1,0,490,368,the head and the neck of a giraffe,
2409125,432,41,24,34,statue of two monkeys,
2409126,413,139,50,118,Man is holding a camera.,
2409129,239,110,103,58,white and blue diamond back splash,
2409132,185,1,104,125,bronze horse with clock on a pedestal,
2409133,75,11,351,187,two views of same skateboarder,
2409136,200,108,95,216,Man walking up steps with black backpack.,
2409137,8,138,356,358,A mountain side.,
2409140,284,9,74,68,a person wearing a helmet,
2409147,9,58,270,292,Man sitting on a boat.,
2409149,10,48,485,325,Building in the mountains,
2409156,148,285,45,68,one scooter is leaned on wall.,
2409159,24,154,430,163,the couch is blue green,
2409160,14,45,475,187,three cows standing on grass,
2409165,11,150,365,145,several elephants lined up in a row,
2409168,134,239,322,113,The two orange and white cones,
2409171,98,346,75,74,Brown tiled floor,
2409172,39,100,195,241,Man on a skateboard.,
2409175,2,112,495,73,the ocean filled with waves on a sunny day,
2409180,1,2,496,360,sunny outdoor daytime African scene,
2409182,31,66,460,329,small kitchen with table and chairs in middle of room,
2409186,29,60,392,239,a child eating a banana,
2409188,28,49,367,311,Parked red truck on pavement.,
2409194,49,173,325,290,Chorros on a plate.,
2409201,198,69,301,209,yellow octopus kite,
2409203,72,277,174,70,White bathroom sink,
2409218,66,472,16,26,Person with a blue shirt,
2409219,34,235,144,122,Yellow corn in a pan,
2409223,62,406,207,77,large patch of green grass,
2409225,9,2,402,367,cat standing on a person's lap,
2409230,63,1,305,295,Man with a mic.,
2409233,48,78,240,250,boy in a yellow shirt,
2409238,202,181,122,108,the toilet is full of pee,
2409240,65,118,405,220,hot dog in bun with toppings,
2409249,91,328,80,85,Green wheel on a cart,
2409253,107,56,389,272,Woman leading horse around.,
2409258,178,46,150,285,blond woman wearing white sash,
2409263,139,151,131,115,the man is skateboarding,
2409264,128,20,145,308,a boy standing in a boat,
2409271,4,42,325,313,passenger train,
2409278,132,145,150,93,flying up red tie,
2409279,179,186,154,312,A green vase sitting on a small round table.,
2409281,419,132,76,36,black cursive writing on refrigerator door,
2409284,182,81,144,112,the man is up in the air,
2409285,172,1,325,300,paper tray holding hot dog,
2409286,51,56,81,53,white round frisbee,
2409288,196,115,83,82,a person sitting on a motorcycle,
2409289,88,108,162,157,stop sign in road,
2409293,251,137,137,75,Sun shinning through the clouds,
2409294,145,183,203,205,man holding girl's hand,
2409314,89,23,46,62,part of a blue tent,
2409315,58,36,418,290,food on tray,
2409318,252,13,101,131,Black open-faced helmet,
2409323,26,6,218,223,a propeller on a plane,
2409333,165,351,156,135,Green and yellow cardamom pods,
2409336,236,4,161,65,this is the sky,
2409341,206,146,111,148,this is a flower vase,
2409343,175,92,290,120,a white passenger airplane,
2409350,212,71,122,121,An elephant,
2409351,14,87,399,280,A gray navy plane.,
2409357,251,312,51,51,well-trimmed hedge,
2409361,244,79,90,94,this is a man,
2409362,253,83,144,143,this is a metallic wheel,
2409363,196,257,57,53,white and black soccer ball,
2409364,242,61,181,92,Six pillows on bed,
2409368,235,93,211,175,a person riding motorcycle on the street.,
2409373,41,30,297,301,Stuffed teddy bear sitting in blue chair,
2409383,181,128,55,48,White swirl on the kite,
2409386,87,38,211,205,stop sign on pole,
2409389,157,239,89,28,Person standing on a snowboard.,
2409390,12,154,275,106,this is a pool of water,
2409391,62,180,82,66,part of a brown glove,
2409392,25,11,130,114,black metal fence in front of walkway,
2409394,170,134,39,52,this is a mobile phone,
2409395,4,20,305,182,this is a cat,
2409397,51,66,266,393,woman with a video remote.,
2409400,284,141,21,321,black metal pole supporting sign,
2409401,26,76,273,401,Lunch time,
2409403,62,40,223,116,the bananas are three,
2409405,55,66,410,260,busy intersection in city,
2409406,225,140,97,185,this is a teddy bear doll,
2409408,155,334,39,31,sliced banana are arranged round the strawberry,
2409410,282,149,59,55,A light blue helmet,
2409412,302,10,135,135,part of a cloudy sky,
2409415,261,63,90,94,part of the white sky,
2409419,11,254,290,119,Orange and black snowboard,
2409422,251,118,86,105,two people on ski lift,
2409428,169,272,54,122,Blue neck tie with daisies on it,
2409429,11,22,475,325,two cats and a person at a desk,
2409431,255,46,182,255,tennis player on a court,
2409434,111,120,387,245,there are some people in the room,
2409442,365,69,132,102,slice of pizza in midair,
2409446,92,45,147,200,Man is wearing a wetsuit.,
2409449,300,242,35,36,part of some cabbage,
2409452,205,160,156,282,this is a tennis player,
2409459,25,240,465,85,vehicles parked in a lot,
2409462,255,55,96,46,A blue trailer,
2409465,182,158,308,149,a plant is on the sink,
2409466,2,88,491,195,red and white markings in the road,
2409469,38,199,109,48,the pants are purple,
2409470,381,300,90,27,sand is wet,
2409471,80,11,155,138,striped pattern created in green grass,
2409478,27,42,75,76,the sky is purple,
2409488,160,252,131,45,part of white snow,
2409494,270,93,52,108,A metal ventilation grate,
2409499,8,210,256,107,white wave of water,
2409504,166,173,47,62,briefcase on sidewalk,
2409505,0,108,499,265,Table has wooden surface.,
2409509,161,47,112,50,woman with plaid umbrella,
2409515,300,448,126,36,shadow on bottom of plate,
2409520,290,209,50,41,Black saddlebags on motorcycle.,
2409522,330,0,62,69,Beer mug sitting on a table,
2409525,131,177,57,152,Hot cooking sausages,
2409527,137,158,52,72,open mouth of a bear,
2409531,57,201,95,96,tire with white side walls,
2409535,269,16,197,122,Blue sky with white puffy clouds,
2409536,138,265,86,15,large silver spoon,
2409540,162,142,34,90,Man holding a surf board.,
2409541,103,70,300,242,black and red bench,
2409547,4,138,72,162,Orange flowers in a vase,
2409549,7,56,490,307,white sign with a black frame,
2409550,1,133,192,269,A green palm tree behind the street signs,
2409552,391,200,60,103,a man flying kites,
2409563,1,124,227,363,black leather handbag,
2409565,100,70,330,178,man holding a surfboard,
2409568,123,269,106,74,An upside down skateboard,
2409570,66,47,296,202,the bird is white,
2409571,0,50,422,318,Two men playing Wii games.,
2409572,246,312,32,23,Sneaker on a foot,
2409578,134,62,297,225,burgundy and yellow train,
2409582,161,57,105,132,Man's head,
2409586,91,122,268,183,the leaves are green,
2409590,2,233,167,225,A toilet,
2409591,33,7,142,296,Man is holding skateboard.,
2409610,65,32,403,299,A sign at the end of the road,
2409612,53,50,205,317,this is a tennis player,
2409615,299,53,188,320,two people are riding an elephant,
2409620,225,103,274,290,bbq sauce over meat and bread,
2409621,56,255,242,117,two empty chairs in a classroom,
2409624,103,44,347,439,Woman is playing tennis.,
2409629,142,14,334,84,this is the sky,
2409631,91,180,26,50,short young girl in a bathing suit,
2409637,14,48,298,140,large canopy bed,
2409643,23,0,461,312,Two women walking together.,
2409645,88,147,139,137,A fighter aircraft,
2409652,142,175,37,32,a bear walking in the grass,
2409656,404,5,88,134,water falling over gray brown rocks,
2409657,237,272,132,44,Blue umbrella in trees,
2409658,178,418,67,49,man wearing adidas shoes,
2409666,37,50,320,405,lunch placed on outdoor table,
2409667,285,263,160,49,Brown horse laying down in the grass,
2409668,108,155,120,135,Hand holding a doughnut with bites out of it,
2409677,0,3,496,322,the train is in the station,
2409679,16,74,386,157,black and yellow train on tracks,
2409680,193,225,45,36,white stone in middle of road,
2409682,110,114,39,27,round light in ceiling,
2409684,0,0,497,365,slushy snow covered airport tarmac,
2409690,18,4,310,184,American cheese on bread,
2409691,273,234,124,45,The bird in the lead,
2409693,146,129,157,75,white bird with yellow beak,
2409694,51,92,401,195,black tennis racket over court,
2409702,242,75,256,246,Cat sitting on the couch.,
2409705,88,60,285,262,two zebras standing on plane,
2409707,316,159,60,77,Little girl is smiling.,
2409710,66,245,108,65,small spot on street,
2409712,46,148,34,44,yellow and blue kite flying in the air,
