image_id,X,Y,Width,Height,English_text,French_text
2384304,1,72,330,423,A beach during daylight hours.,
2384311,320,0,175,169,Shoulder length red hair,
2384313,187,410,35,59,White and black toilet brush,
2384314,247,169,21,32,kite flying in the air,
2384315,31,0,200,97,Large black scoreboard,
2384316,41,63,440,283,four giraffes at the bottom of a hill,
2384324,95,23,306,293,an elephant in the water,
2384325,237,43,85,174,bottle on the shelf,
2384326,56,225,76,55,Person walking out of the water with a surfboard,
2384333,8,16,490,315,a beautiful park,
2384334,247,77,121,143,The frisbee is yellow and in the air,
2384342,158,191,147,128,Bench on the sidewalk.,
2384352,3,1,410,363,the bowl is round,
2384361,2,336,496,160,A table with pizza on it,
2384367,24,54,155,297,the motorcycle beside the building,
2384368,0,41,496,259,Family portrait in black and white,
2384371,103,395,102,72,ground covered in snow,
2384378,227,277,42,26,five blue stars,
2384382,422,306,6,7,side of a plate,
2384387,119,144,368,94,A small plane in the air,
2384389,184,171,30,25,black numbers on side of train,
2384403,346,40,68,247,brown and tan spotted giraffe,
2384406,95,119,100,52,woman is wearing eye glasses,
2384412,381,283,85,45,black knob on the stove top,
2384419,4,4,271,355,boy is playing a game,
2384423,5,94,326,271,a dark blue couch,
2384437,293,155,105,133,woman sitting at table with a drink in hand,
2384451,216,165,37,45,neck of the giraffe,
2384452,57,48,388,183,a brown dog,
2384462,105,124,154,167,Boy dressed in white shirt & dark pants doing skateboard stunts.,
2384464,32,1,405,370,plate with a healthy meal,
2384470,23,208,123,291,guy wearing blue shirt,
2384473,78,105,324,138,an airplane,
2384474,106,72,185,185,the laptop screen is on,
2384477,6,8,488,315,people skiing on a sunny day,
2384478,23,97,101,74,The sign is black and white,
2384479,150,89,42,40,a top of a glass,
2384488,86,36,285,301,elephant walking in elephant exhibit,
2384493,1,63,485,356,A trio of calves,
2384496,21,93,471,222,Three elephants walking together,
2384498,133,31,72,44,man's hat is black,
2384499,363,59,133,147,Open carton of brown eggs,
2384500,42,193,105,274,a clear wine glass,
2384501,375,181,123,172,part of a brown wooden chair,
2384502,156,28,157,91,man wake boaring in ocean,
2384507,137,20,238,320,group of stop signs,
2384516,47,11,258,198,red pasta sauce,
2384517,50,239,51,62,A dog wearing a sweater,
2384520,97,24,180,165,The top of fire hydrant is blue.,
2384522,0,135,37,25,clock,
2384523,10,9,415,315,colorful bible truck,
2384524,142,380,41,80,cell phone has pink cover,
2384528,0,53,125,222,Part of a yellow bus,
2384533,196,45,152,134,polar bear is white,
2384536,134,197,70,85,scrambled eggs,
2384540,0,7,477,137,big foggy mountains,
2384544,35,45,326,254,Huge truck driving down the road,
2384546,170,16,152,263,two men standing next to each other,
2384550,16,330,211,161,A powerboat is on a lake,
2384553,127,151,138,107,white upper cupboards in a kitchen,
2384556,82,140,155,156,Large black and gold clock face.,
2384558,115,119,295,252,man's shirt is blue,
2384565,91,168,407,206,cat is watching tv,
2384566,167,69,60,147,Large woman in yellow shirt,
2384568,47,75,445,311,Four giraffes,
2384571,103,250,390,82,sand on the ground,
2384573,203,99,54,55,Person wearing black and red helmet.,
2384582,4,51,481,337,red-billed gull aka mackerel gull or tarapunga or akiaki. you asked,
2384587,245,160,34,65,Large beautiful hanging light,
2384588,156,412,116,45,cell phone held in boys hands,
2384591,203,290,164,64,Red and white canopy,
2384592,2,23,491,349,a display of surfboards,
2384593,0,285,48,17,white light bulbs in the sky,
2384596,404,231,14,22,fire hydrant on the sidewalk,
2384602,233,273,52,217,a do not enter sign,
2384606,19,426,115,73,brown table top surface,
2384609,8,309,96,166,flowers on the table,
2384611,268,80,231,82,an off-white colored keyboard used for computers resting on top of other electronics,
2384619,4,30,325,468,a man in a uniform,
2384623,1,109,463,220,a dining room and living room,
2384625,34,5,257,325,Elderly woman sitting on a park bench,
2384628,164,1,77,45,part of giraffe in the back,
2384634,42,109,179,182,a red and white perpeller,
2384653,24,81,242,367,Girl rides a motorcycle,
2384654,122,40,47,22,a colorful kite in the air,
2384655,19,67,45,41,Clock on the table.,
2384661,147,318,78,43,tagging on the stop sign,
2384665,141,0,220,97,tree canopies the walkway,
2384669,0,127,433,130,man is carrying surfboard,
2384675,132,406,108,57,Red and white bricks,
2384677,315,156,147,175,plain white refrigerator,
2384679,95,187,290,133,salami meat hanging out of a sandwich,
2384683,58,107,412,152,a picture of a lighted palace,
2384685,92,165,285,145,black and white bowtie,
2384687,38,61,461,265,THE RICE IS IN THE SPOON,
2384693,319,163,60,107,decorative pattern on high back of chair,
2384697,229,167,51,50,four signs in the shot,
2384700,23,100,470,194,people sitting around tables,
2384705,291,100,132,117,person eating some food,
2384708,89,80,292,190,An Amtrak engine on a track,
2384709,23,128,19,26,a prohibiting road sign,
2384711,96,210,279,119,Hat with floral accented band,
2384715,0,100,244,144,A white and green boat,
2384717,108,303,102,71,A clock on the building.,
2384719,321,167,54,28,cellphone in the mans hand,
2384721,0,362,43,118,Yellow baseball cap,
2384723,1,213,475,160,rainbow and white striped table cloth,
2384731,259,39,61,71,right ear of cat,
2384733,61,326,190,135,Pink and red tennis racket.,
2384738,47,32,343,335,a desk full of stuff,
2384751,53,171,147,177,slices of cut orange,
2384753,226,157,80,89,a large t.v.,
2384757,35,0,172,499,blonde women hitting a ball with a tennis racket,
2384758,56,42,262,455,man dressed in women's clothing,
2384769,93,2,330,282,head of a giraffe,
2384775,291,110,104,105,large lips on man,
2384779,84,431,66,48,a brown table,
2384787,0,108,69,22,Blue-and-white striped canopy.,
2384791,42,33,244,447,dog and people surrounded by water,
2384796,209,157,67,153,Boy is standing in the grass,
2384798,398,110,40,25,black light on top of building,
2384799,148,380,47,90,woman wearing black pants,
2384800,33,459,131,36,untied shoe,
2384801,0,0,498,367,green lawn,
2384806,250,258,28,52,bunch of knifes in a base,
2384807,100,92,71,95,blue letters that say fifi,
2384813,133,58,53,62,The paper towel dispenser on the left.,
2384818,137,76,277,68,People standing around on the street.,
2384826,155,74,212,215,black clock and white face,
2384828,35,169,264,182,Trains coming down the track,
2384833,336,116,162,62,People in the building in the back ground.,
2384837,241,132,147,157,a yellow and white train,
2384839,219,293,52,67,Apple sitting on pile of fruit.,
2384840,18,225,74,62,The back tire of a diesel,
2384849,153,214,203,263,a person wearing a custom,
2384851,411,70,64,106,a cone black and white vase,
2384852,238,45,120,139,a yellow train passenger car,
2384854,207,42,290,271,train pulling into station,
2384859,58,13,167,133,a laptop computer screen.,
2384863,56,235,44,30,an older off white corded phone,
2384869,387,134,70,61,uncooked donuts,
2384872,112,81,271,54,Windows on black paneling,
2384883,76,340,61,27,a very small shadow,
2384892,42,138,321,148,Baby elephant with snout out of water,
2384901,284,356,48,71,part of a white controller,
2384903,142,134,35,71,a giraffe left eye.,
2384909,7,15,485,350,plate with food on it,
2384911,265,75,67,135,Skateboarding on railing,
2384914,61,35,345,267,statue of elephant standing,
2384916,65,174,275,192,person sutting pizza,
2384929,249,203,62,54,Man holding a tennis racket.,
2384933,141,83,98,249,A little girl,
2384935,315,8,164,308,man riding on skateboard,
2384938,125,55,190,37,white sign with black lettering and red number,
2384945,33,165,229,167,A very large tower,
2384951,129,29,110,447,tall clock post,
2384952,7,1,313,205,giraffes in an enclosure,
2384953,5,0,494,322,a sandwich is on newspaper,
2384954,0,30,497,344,The building is next to water.,
2384956,250,35,143,87,Microwave above stove,
2384962,25,240,30,80,woman wearing long sleeve shirt,
2384965,126,178,86,139,A man doing a skateboard trick,
2384966,14,191,420,108,3 horses are walking,
2384973,11,41,304,38,long white train,
2384974,220,80,99,87,a person riding a neon surfboard.,
2384977,107,116,167,192,illuminated face of clock,
2384988,1,63,140,178,silver fork on plate,
2384990,19,26,275,314,A double decker bus,
2384995,38,99,212,191,Red train on the tracks,
2384997,20,203,37,77,reflection of yellow building in water,
2384998,29,13,414,262,a group of giraffes,
2385008,86,219,80,154,Cat has stripes on tail.,
2385010,59,38,67,100,a wet roll of pink toilet paper,
2385016,45,15,420,355,two doughnuts on flimsy napkin,
2385024,36,33,181,212,Display case hanging on the wall,
2385027,297,154,89,177,This is a person,
2385032,35,51,186,391,a young man riding a skateboard.,
2385036,12,8,487,316,a black and white streetscape setting,
2385037,185,89,125,105,White long sleeve shirt on skier,
2385041,44,51,191,438,Two people are on a bicycle.,
2385042,120,226,34,27,piece of tomato in salad,
2385043,137,55,50,48,black cap of skateboarder,
2385045,71,23,419,252,One of two giraffes,
2385050,148,111,62,117,white refrigerator with freezer,
2385052,121,233,200,97,colorful graphity on a wall,
2385058,2,180,462,170,a tray of food,
2385059,214,82,187,158,Person skiing down a slope,
2385062,25,95,318,293,two hotdogs in buns,
2385064,272,150,34,37,the woman is wearing a black shirt,
2385065,288,177,107,85,Bumpy plain glazed doughnut.,
2385066,201,49,175,92,Toothbrushes wrapped in plastic,
2385071,76,95,241,157,A standing cow elephant,
2385072,35,133,463,125,two green and white train cars,
2385075,22,123,271,95,white plane with red tail wing,
2385076,25,43,148,143,a ram on a hill,
2385081,190,110,142,202,two men riding on a motorcycle,
2385082,54,113,211,248,Two giraffes at a zoo,
2385085,53,30,303,326,man getting ready to hit a tennis ball,
2385086,64,85,171,143,Tall clock on a pole,
2385087,21,126,408,365,the baseball player is running,
2385098,291,23,72,110,Framed mirror hangs on the wall,
2385100,12,13,476,352,people walking a curved and steep sidewalk,
2385104,3,6,336,488,an old broken-down bathroom,
2385106,10,131,465,320,pizza on a cutting board,
2385108,188,70,75,71,person standing on a surfboard,
2385110,59,16,112,50,this is the sky,
2385111,69,2,416,180,mom giraffe cleans back of baby giraffe's ear,
2385114,152,239,104,90,a modern white chair,
2385124,185,146,49,196,This is forest vegetation,
2385129,332,139,24,22,The baseball being hit by the batter.,
2385130,285,148,12,10,The lights on the top of the train.,
2385132,0,112,392,205,Two people sitting together,
2385138,161,17,200,227,a toddler sittng down,
2385142,260,41,177,230,large parrot on shoulder,
2385147,437,191,20,36,The person riding a bike.,
2385150,48,2,218,487,a person wearing a bunny suit,
2385156,5,10,485,306,professional tennis match on clay court,
2385161,245,137,51,34,the baseball bat in the man's hand,
2385162,156,105,105,63,the microwave above the stover,
2385173,5,2,311,68,This is forest vegetation,
2385174,114,19,147,170,red stop sign on pole,
2385181,227,103,97,170,a brown elephant walking on a field,
2385182,1,0,488,330,doughnuts in a doughnut shop,
2385185,120,76,71,48,Blue flowers in a vase.,
2385187,162,251,130,122,silver colored back of a stop sign,
2385188,175,210,55,135,Woman in red hat,
2385193,164,168,81,115,The trunk of the elephant.,
2385194,449,157,9,12,white arrow on sign.,
2385195,113,164,290,312,big tan teddy bear,
2385199,60,35,117,295,a shirtless man on beach,
2385207,40,9,137,240,medicine cabinet above sink,
2385211,33,380,121,118,a bike's rear tire,
2385214,211,14,195,266,man and child,
2385221,111,142,104,111,black and white clock,
2385227,315,214,62,95,Child's blue ski outfit,
2385231,37,406,46,73,A ceramic coffee mug,
2385236,16,168,10,23,This is a support pole,
2385239,123,271,205,225,tthe pizza is rectangle,
2385241,226,6,63,27,Blue hood on man's head.,
2385256,72,21,368,302,there are two giraffes,
2385259,89,19,146,435,mannequin standing with motorcyle,
2385265,112,398,105,87,white soccer ball on green grass,
2385274,63,201,60,99,this is a ladder,
2385279,57,135,54,56,This is a fruit,
2385283,148,197,72,176,this is a lady,
2385284,5,114,477,180,A heard of male sheep,
2385285,272,10,221,321,guy smiling,
2385286,433,196,8,22,Person has dark hair.,
2385290,3,212,39,15,orange words on front of building,
2385296,43,17,440,250,train near platform and other tracks,
2385297,130,260,126,201,a yellow fire hydrant,
2385306,29,46,402,287,A motorcycle is parked on the sidewalk,
2385307,42,25,223,68,multicolored kite is in sky,
2385308,164,155,103,167,A man playing tennis.,
2385317,15,106,325,180,group of people riding elephants,
2385321,10,47,146,260,the hiar is brown,
2385323,59,73,254,235,player in white swinging bat,
2385328,41,180,45,74,A plastic bottle of water,
2385330,311,234,151,117,the birs is perched,
2385332,299,275,16,18,this is the wall,
2385334,248,47,11,11,polka dot on baby decoration,
2385335,250,195,13,26,The Frisbee in the guy's hand.,
2385338,67,187,118,289,Black and blue baseball bat,
2385339,351,283,120,84,dessert with fruit on plate,
2385348,181,265,299,202,the hotdog looks yummy,
2385351,70,86,232,104,A mostly metal and wood roof.,
2385352,32,448,317,44,51/2 year old new year's card [in july 2010],
2385355,7,217,291,213,two women skiing on snow,
2385357,191,165,105,95,The green pants the snowboarder is wearing.,
2385360,287,153,137,169,A person standing in the snow,
2385364,340,312,125,51,white toilet has seat down,
2385370,436,112,50,141,man sailing behind a black and white parasail,
2385374,7,90,483,230,sheeps in a farm,
2385379,242,51,90,54,a flat screen tv on the wall,
2385380,318,228,86,80,the cow is brown,
2385382,54,306,206,177,THE HOT DOGS ARE ON THE PAN,
2385385,67,361,45,53,red and white stop sign,
2385393,364,154,20,26,brown spots on the giraffe,
2385400,132,81,55,150,a cotton white blanket.,
2385405,255,86,42,28,the hat on the man's head,
2385406,206,155,56,109,this is a man,
2385412,23,140,229,101,two white planes in a terminal,
2385413,410,2,88,279,poster hanging above bed,
2385417,131,114,132,152,a red and white stop sign,
2385421,121,58,20,18,this is a tennis ball,
2385422,94,75,130,76,Grey and White Umbrella,
2385423,268,175,9,9,Person looking at a wave,
2385424,124,155,260,133,A cake in the shape of thomas the train,
2385425,69,182,30,33,Green Light on pole,
2385431,392,5,68,63,this is the sky,
2385435,249,189,99,68,Tracks are brown color.,
2385446,175,47,147,119,a child's drawing on wall,
2385447,67,220,84,27,White frisbee in midair.,
2385451,188,128,179,152,Black and white cow,
2385464,245,58,49,33,two black speakers hanging from ceiling,
2385467,383,52,58,25,a pair of ski goggles,
2385468,158,183,140,171,THIS IS A CAT,
