image_id,X,Y,Width,Height,English_text,French_text
2339373,126,362,41,25,Giraffe standing by the trees.,
2339376,1,22,388,435,the man is smiling,
2339377,0,148,306,287,food on the plate,
2339381,247,157,29,25,Person wearing blue helmet.,
2339384,15,42,268,256,this is a person,
2339388,179,90,89,57,clock on the side of the tower,
2339398,85,107,34,37,top of a lamp post,
2339400,140,340,181,132,sheep in field,
2339401,357,167,40,35,White kettle on stove,
2339405,448,307,31,14,White toilet in the bathroom.,
2339407,203,80,31,45,person on the row crew,
2339408,46,97,355,35,propellor with two blades,
2339409,17,237,199,260,the baby carriage has bags of luggage,
2339410,97,270,21,21,a small brown duck swimming in the water,
2339412,342,133,67,144,front of a vehicle,
2339414,58,114,306,280,a lady petting the cow,
2339415,239,242,21,27,Table # 44,
2339416,71,95,390,223,bottom layer of anniversary cake,
2339420,20,134,96,49,a laptop on a counter,
2339422,78,95,321,257,black bird perched on a ledge,
2339425,180,91,91,75,the sign says donuts,
2339426,91,24,334,269,food items ready to eat,
2339436,353,45,10,17,The spot is brown.,
2339441,76,41,154,238,A giraffe sipping water,
2339445,100,6,28,61,Canadian flag on pole,
2339446,112,0,237,325,girl holding a baseball bat,
2339455,194,15,65,120,kite in the air,
2339463,37,61,334,437,this man is asleep,
2339466,129,284,305,90,Wooden table in front of sofa,
2339469,65,47,123,150,zebra furthest from the others,
2339474,192,153,51,30,Animal on the rocks,
2339476,258,288,64,109,feet of a person,
2339484,1,0,498,62,The sky is blue.,
2339485,326,108,106,190,The man is wearing a baseball uniform.,
2339489,230,156,210,91,Four white clydesdale horses,
2339492,304,0,157,67,sign for the store,
2339498,26,12,119,44,blue sky above the land,
2339502,86,148,93,88,group of people getting on an airplane.,
2339504,288,185,23,28,Silver faucet on sink.,
2339506,95,39,301,238,Two zebras side by side,
2339508,181,254,203,136,television with a lady on it,
2339521,46,104,326,260,A stuffed red elephant toy,
2339524,232,154,28,21,cockpit of an airplane,
2339532,69,11,214,480,man wearing a darth vader mask,
2339533,285,135,62,115,man in red on a motercycle,
2339544,332,86,156,151,medium orange cow with horns,
2339549,4,3,428,280,A bedroom,
2339550,2,2,378,70,a building is on the side of the lake,
2339551,106,217,267,150,White double decker city bus.,
2339557,196,120,130,35,cloud in the sky,
2339561,280,122,24,28,Dog walking in the water.,
2339563,33,24,141,159,round clock in photo,
2339572,207,80,60,102,Woman in the kitchen,
2339581,0,71,250,208,vehicle parked on a street,
2339582,207,468,13,8,White toilet in th bathroom.,
2339583,151,119,214,138,a full grown adult zebra,
2339587,0,0,215,310,White toilet against black wall,
2339591,88,163,205,143,White laptop on top of the electric appliance,
2339592,185,96,210,211,three ducks standing together,
2339600,379,130,80,102,a crock pot,
2339602,6,2,445,371,a man eating a doughnut,
2339606,1,2,495,112,this ball game is taking place at night,
2339610,115,116,215,190,an old green label maker,
2339613,245,101,46,35,a black helmet on a man's head,
2339615,1,145,120,81,hood of small red sedan,
2339618,216,26,200,292,a white bird flying,
2339619,255,434,33,27,a white tennis shoe on a woman,
2339622,208,16,281,283,Hotdog sitting on a plate.,
2339629,1,3,497,277,sheep in the field,
2339631,0,151,489,77,a row of colorful umbrellas,
2339632,60,50,437,301,a dog laying on the floor,
2339634,217,139,195,151,stairs attached to plane,
2339636,11,40,104,142,Apple laptop computer.,
2339643,201,46,137,137,a person that is surfing,
2339656,86,29,125,76,an orange and black witch hat,
2339662,97,75,128,210,baby is posing for photograph,
2339664,90,461,45,20,blue square on cloth,
2339668,45,116,267,381,people at the sidewalk,
2339671,313,108,34,19,glasses on a persons face,
2339675,162,206,47,19,Dark sunglasses on a man's face.,
2339678,130,113,32,70,long white kitchen cabinet in kitchen,
2339679,155,14,233,352,A man bent down with his hands on his knees,
2339681,12,10,477,361,A person is sitting at a table,
2339685,158,110,68,71,face of a clock,
2339686,36,53,385,267,Children playing soccer on the soccer field,
2339692,0,10,111,231,white and blue book,
2339693,208,118,77,67,A man surfing a wave,
2339704,242,51,70,250,a very tall office building,
2339706,193,51,40,15,Top of hydrant is red.,
2339709,51,68,447,233,The train is long.,
2339715,63,44,200,229,woman eating in a restaurant,
2339717,283,222,58,48,White pearl looking necklace,
2339724,104,310,32,51,White plunger on ground.,
2339726,196,122,303,179,a blue train on the tracks,
2339731,21,148,108,111,leaves on the tree,
2339744,417,113,71,151,Black zebra tail blowing in the breeze,
2339745,152,3,274,162,the cat in fridge,
2339748,136,306,138,69,The grass is short and green,
2339755,153,64,102,192,giraffe on the road,
2339758,127,70,130,147,Spotted giraffe in tall grass,
2339765,331,154,47,39,a polar bear over a rock,
2339766,182,43,259,287,man pushing button on oven,
2339767,100,155,118,194,two zebras in the grass,
2339768,125,36,169,203,man doing trick,
2339769,252,125,56,74,black and white tile,
2339770,215,76,84,153,the dog is running,
2339772,201,36,239,293,a kid sitting inside a suitcase,
2339773,115,98,369,206,walking giraffes,
2339776,14,17,485,345,A brown colored sofa,
2339786,72,201,195,187,food in a container,
2339790,18,384,277,99,Shirt has two breast pockets,
2339791,383,49,51,90,street light in the air,
2339793,208,275,65,22,a yellow tennis ball in motion,
2339799,423,5,75,60,flat screen monitor on wall,
2339802,124,271,56,52,silver flowers in vase,
2339805,197,68,87,79,kite,
2339809,298,2,200,204,a white tub enclosure with built in shelf,
2339810,43,64,229,263,Batter at home plate.,
2339820,192,111,75,55,the goggles are on the hat,
2339823,321,2,85,227,blue towel hanging on wall,
2339824,10,16,334,470,A photo of a woman,
2339831,106,29,195,423,skier,
2339833,98,76,264,238,man sitting on a bench,
2339836,93,95,152,120,a text in the box,
2339837,306,79,82,110,boy has brown hair,
2339838,122,11,191,122,steam coming out of the train,
2339848,24,357,55,54,hinge on a door,
2339849,111,92,232,172,double decker bus on street,
2339851,72,32,95,188,metal cage near giraffe,
2339853,125,314,110,125,a dark colored piece of food.,
2339857,77,157,62,19,Dark blue sign with \Pietra L.\ in white letters,
2339859,41,6,32,15,a pair of yellow framed sunglasses,
2339861,142,339,189,147,Bench on sand by foliage,
2339865,128,4,370,75,cloudy dark blue sky,
2339866,3,4,489,325,darkness in night sky,
2339870,42,147,142,331,Little girl standing next to man,
2339879,141,46,250,282,Yellow fire hydrant on street,
2339883,112,331,35,37,button on the device,
2339888,32,138,18,28,The window is rectangle,
2339889,373,42,32,41,head of a person,
2339891,138,62,229,381,Black and silver refrigerator,
2339892,19,79,92,65,this is a board,
2339900,176,48,119,137,A person is packing clothing,
2339904,15,50,278,326,a young man posing for his school pictures,
2339905,206,140,200,140,The cup has liquid in it,
2339906,17,1,445,330,Child holding a donut,
2339907,231,174,19,21,roll of toilet paper on metal holder,
2339908,252,72,60,56,boy has grey hood,
2339915,4,72,487,299,this is a large bed,
2339916,41,160,69,87,juice carton on table,
2339920,339,80,43,41,someone dressed as mickey mouse,
2339927,68,105,216,110,white and red trolley,
2339933,202,128,77,71,surfer,
2339937,158,191,85,36,white lettering on red trolley,
2339939,97,14,179,195,the head of a female zombie.,
2339940,8,14,294,485,this is a slice of pizza,
2339944,74,23,216,413,young model posing with a chair and suitcases,
2339945,14,37,456,166,large white plane on tarmac,
2339949,254,172,34,69,a dark figure on skis,
2339950,147,2,351,330,young person with white shirt,
2339951,194,25,162,110,baggage carousel at the airport,
2339954,1,39,495,251,airplane is being serviced,
2339958,220,93,105,94,head of a cat,
2339962,101,41,25,131,a clock tower with an arch,
2339970,223,143,71,42,bike,
2339972,25,33,454,269,parked black motorcycle on the road,
2339978,41,115,25,31,the nose of a passenger jet,
2339979,118,6,146,159,A small childs face,
2339988,262,50,31,32,man is wearing goggles,
2339990,189,0,177,137,darkness of night sky,
2339991,1,98,496,230,Old fashioned red fire truck,
2339993,154,31,140,229,Person riding on motorcycle.,
2339994,0,199,145,139,platform at train station,
2339995,58,163,360,102,An orange foreign school bus,
2339997,209,243,41,64,a man playing a guitar,
2340006,133,168,93,117,mirror has golden frame,
2340009,141,55,347,150,three small boats on the shore,
2340010,215,271,21,21,tip of silver fork,
2340016,1,5,495,410,van in the forefront.,
2340021,166,139,13,23,man wearing green coat,
2340022,0,131,487,242,Tow men playing nintendo wii,
2340025,97,27,371,328,the sheep is grazing,
2340028,16,239,232,117,a bench on a beach.,
2340029,36,180,20,60,long tail on cow,
2340032,16,259,139,228,man smiling riding his bike down the street,
2340035,75,117,410,255,Clocktower in the middle of a paved area,
2340040,132,35,351,217,zebras running on field,
2340048,277,103,139,75,hands holding a phone,
2340049,37,3,372,210,A herd of pigeons eating pizza in the street,
2340058,185,103,71,40,person's hand in picture,
2340065,5,170,10,7,small yellow colored flag,
